id,bid,正文,头条文章url,原始图片url,视频url,位置,日期,工具,点赞数,评论数,转发数,话题,@用户
4914421783332878	,N63aWdZ26,【#贵州黄果树大瀑布进入最佳观赏期# 】#共聚多彩贵州共建世界旅游目的地# 298立方米/秒！6月19日，贵州黄果树大瀑布迎来了今年以来最大流量，相当于每秒298吨水倾泻而下。大瀑布水流的声音如同咆哮一般，震耳欲聋，可以用“瀑声震天，十里相闻”来形容。据了解，黄果树大瀑布已进入一年中的最佳观赏期，前来观赏的游客络绎不绝，“非常壮观！”游客李先生说，真是不虚此行。此外，由于景区水位上涨，黄果树景区一些区域也进行了临时关闭，6月19日，黄果树景区公告称，受强降雨影响，景区水位上涨，为确保游客游览安全，现临时关闭陡坡塘护栏桥、陡坡塘观景台，大瀑布水帘洞、大瀑布下观景台游道及天星桥下半程，开放时间另行通知。#避暑旅游到贵州景区门票有5折优惠#（贵州日报天眼新闻记者 周强 视频来源/黄果树新闻传媒中心）@贵州省文化和旅游厅 @贵阳市文化和旅游局 @安顺文化旅游 @黄果树宣传 @安顺黄果树景区 贵州日报官微的微博视频,,,"https://f.video.weibocdn.com/u0/qWZKZ56jgx086mvxqFhe010412006bX00E010.mp4?label=mp4_ld&template=638x360.25.0&ori=0&ps=1BThihd3VLAY5R&Expires=1687181751&ssig=hHxDegiSPC&KID=unistore,video",,2023-06-19,微博视频号,29,6,1,"贵州黄果树大瀑布进入最佳观赏期,共聚多彩贵州共建世界旅游目的地,避暑旅游到贵州景区门票有5折优惠","贵州省文化和旅游厅,贵阳市文化和旅游局,安顺文化旅游,黄果树宣传,安顺黄果树景区",2023-06-19 19:08:41
4914396398359095	,N62vZz4A7,【#贵州村超怎么这么好看# 民族风小姐姐真甜！】贵州“村超”现场，民族风小姐姐，颜值超高、又美又飒、气质非凡，比榕江西瓜还甜！☞戳视频↓一起看，贵州“村超”赛场上的那些一眼万年！#让贵州村超火得更加猛烈# （素材来源：贵州村超纪实 小城老吴 剪辑/李舒涵）@微博区域热点 @微博热点 @榕江在线 @黔东南新闻网官方微博 @乐生活在贵州 贵州日报官微的微博视频,,,"https://f.video.weibocdn.com/u0/Zl1uXjPHgx086moBWH6E01041200eXMz0E010.mp4?label=mp4_720p&template=720x1280.24.0&ori=0&ps=1CwnkDw1GXwCQx&Expires=1687181751&ssig=QwCc%2F%2BLlbq&KID=unistore,video",,2023-06-19,微博视频号,34,6,0,"贵州村超怎么这么好看,让贵州村超火得更加猛烈","微博区域热点,微博热点,榕江在线,黔东南新闻网官方微博,乐生活在贵州",2023-06-19 17:27:49
4914382058821263	,N628RB0Or,【#贵州高考志愿填报辅助系统上线# 操作指南来了！】#贵州2023年高考预计查分时间公布# 近日，贵州省招生考试院发布高考志愿填报辅助系统，免费向考生提供志愿填报信息查询服务，助力考生科学填报志愿。☞辅助系统使用指南及操作手册详见下图↓↓↓ #关注2023贵州高考#（来源：贵州省招生考试院）@微博区域热点 @微博校园 @头条校园  @贵阳校园,,https://wx2.sinaimg.cn/large/005DIjE0gy1hf3m29uh0cj30sfcmqe84.jpg,,,2023-06-19,微博网页版,1,0,0,"贵州高考志愿填报辅助系统上线,贵州2023年高考预计查分时间公布,关注2023贵州高考","微博区域热点,微博校园,头条校园,贵阳校园",2023-06-19 16:30:50
4914378120370733	,N622w1yrz,【#贵州高考志愿填报辅助系统上线# 】#贵州2023年高考预计查分时间公布# 近日，贵州省招生考试院发布高考志愿填报辅助系统，免费向考生提供志愿填报信息查询服务。首次公布专业录取数据，以权威官方数据、个性化院校筛选，助力考生科学填报志愿。辅助系统主要有3项核心功能，☞详见下图↓↓↓  系统网址（网页链接）也可在贵州省招生考试院官网、官方公众号查看，考生可通过填写考生号及准考证号登录系统。#关注2023贵州高考#（来源：贵州省招生考试院）@微博区域热点 @微博校园 @头条校园  @贵阳校园,,"https://wx3.sinaimg.cn/large/005DIjE0gy1hf3lm97qtzj31oo2fu1ky.jpg,https://wx1.sinaimg.cn/large/005DIjE0gy1hf3lm9vjjzj312q1tj7rg.jpg",,,2023-06-19,微博网页版,31,5,5,"贵州高考志愿填报辅助系统上线,贵州2023年高考预计查分时间公布,关注2023贵州高考","微博区域热点,微博校园,头条校园,贵阳校园",2023-06-19 16:15:11
4914285265816702	,N5ZCKopbM,【直播｜加快推动贵安新区高质量发展新闻发布会】6月19日上午10：00，贵阳市人民政府、贵安新区管委会召开“加快推动贵安新区高质量发展”新闻发布会，整体介绍贵州省政府《关于进一步加快推动贵安新区高质量发展的意见》和贵阳市委、市政府加快推动贵安新区高质量发展的措施，并发布近期贵安新区招商引资、项目落地等方面取得的成果。天眼新闻全程同步直播。  贵州日报官微的微博视频,,,"https://live.video.weibocdn.com/3d2236fa-88ad-4bc6-8bb6-817d7b778d89_index.m3u8?ori=0&ps=1BThihd3VLAY5R&Expires=1687181753&ssig=U1sIdOA71J&KID=unistore,video",,2023-06-19,微博直播平台,1,0,1,,,2023-06-19 10:06:13
4914276848371395	,N5Zpaz7Mv,【#昨夜今晨贵阳28站大暴雨#】6月18日傍晚到19日早晨，贵阳市多地出现暴雨、大暴雨天气。市气象局提前启动应急响应并积极开展决策和公共服务，强化暴雨预警提前量，为各级党委政府及相关部门城市防洪应急调度提供详实气象服务。据监测，从6月18日14时到19日8时，贵阳市主城区（云岩区、南明区）、观山湖区、白云区、乌当区、清镇市、花溪区、开阳县多地出现暴雨到大暴雨。据监测共有28站大暴雨、42站暴雨，最大小时雨强99.8毫米/小时。主城区防洪道雨量站降水为165.9毫米、新路口雨量站降水为177.7毫米。在强降水到来前，贵阳市气象局、贵阳贵安气象灾害应急指挥部、贵阳贵安防汛抗旱指挥部先后启动暴雨IV级应急响应。应急、消防、交通、城管等各部门依托气象预报预警和“三个叫应”气象服务紧急启动城市防洪应急处置，最大限度降低暴雨造成的损失。在公共气象服务方面，贵阳市气象局依托气象融媒体等平台发布最新气象资讯，特别提醒广大市民防范低洼处、下拉槽等地可能出现的积水，确保行车安全和避免低洼处的门面等被雨水倒灌诱发的灾害。贵阳市气象台依托天气雷达等监测手段，积极指导受强降水影响区域的县级台站发布暴雨黄色、橙色和红色预警，市气象台18日夜间直接将暴雨黄色“跳级”红色预警防灾。截至今日早晨8时，贵阳贵安仍然受降水云团影响，虽然雨势明显减弱，但后续降水仍然不容小觑，相关部门务必加强山洪灾害点、地质灾害点的巡查，确保人民群众生命财产安全。（来源 贵阳网）,,https://wx4.sinaimg.cn/large/005DIjE0gy1hf39z98pegj30hs0ar0vl.jpg,,,2023-06-19,微博网页版,15,4,1,昨夜今晨贵阳28站大暴雨,,2023-06-19 09:32:46
4914252727716848	,N5YMgwnvi,【#贵州最近两天多阵雨或雷雨天气# 贵阳市辖区最新路况】#贵州发布地质灾害气象风险预警# 截止19日6时40分，贵阳市辖区因天气原因临时管制情况如下：一、贵阳市辖区天气：阵雨，气温：19-25℃。二、因天气原因临时管制情况：（一）市区道路：一、云岩区：1、金燕路积水较深无法通行；2、盐沙大道雅关立交桥下积水较深，双向无法通行。二．南明区  花溪大道四方河下拉槽积水较深，双向无法通行。二、花溪区：  石板镇（001县道）五金机电城路段积水较深，无法通行。（二）高速公路:通行正常。（三）县乡道路：通行正常。（来源:贵阳交警）,,https://wx4.sinaimg.cn/large/005DIjE0gy1hf378nqfgbj30rs0qedjv.jpg,,,2023-06-19,iPhone 14,1,0,0,"贵州最近两天多阵雨或雷雨天气,贵州发布地质灾害气象风险预警",,2023-06-19 07:56:55
4914124335615136	,N5VrbnyKI,【#贵州发布地质灾害气象风险预警# 贵州启动防汛Ⅳ级应急响应】#贵州最近两天多阵雨或雷雨天气# 据贵州省气象台6月17日预报，未来三天贵州省将有大范围强降雨过程。本轮降雨过程范围广、局地强度大，主要降雨时段在夜间，部分地区发生山洪、地质灾害、城镇内涝、中小河流洪水等灾害风险高。根据《贵州省防汛抗旱应急预案》规定，经会商研判，贵州省防汛抗旱指挥部决定于6月17日18时启动防汛Ⅳ级应急响应。贵州省防汛抗旱指挥部要求，各地各有关部门要压紧压实防汛责任，密切关注雨情汛情发展，强化监测预警、会商研判、值班值守和信息报送，及时启动本地区本行业防汛应急响应，落细落实防范应对措施，科学高效处置灾情险情，确保人民群众生命财产安全。（来源：贵州省应急管理厅、贵州省防指办公室）@微博区域热点 #贵州身边事#,,https://wx2.sinaimg.cn/large/005DIjE0gy1hf2shokrj3j31w30w94qp.jpg,,,2023-06-18,微博网页版,1,0,0,"贵州发布地质灾害气象风险预警,贵州最近两天多阵雨或雷雨天气,贵州身边事",微博区域热点,2023-06-18 23:26:44
4914104005824700	,N5UUoorgM,【#贵州发布地质灾害气象风险预警# 】6月18日下午，贵州省自然资源厅、贵州省气象局联合发布未来24小时大范围地质灾害气象风险预警预报。预警预报显示，6月18日夜间到6月19日白天（6月18日20时—19日20时），全省共有79个县（市、区、特区）需防范地质灾害，占全省区（县、市）总数的89.8%；其中贵阳市10个区（县、市）均进入预警预报范围，包括8区（县、市）黄色预警，2县蓝色预警。   具体预警预报内容为——黄色预警，即地质灾害气象风险较高，共有55个县（市、区、特区）:南明区、云岩区、花溪区、乌当区、白云区、观山湖区、开阳县、清镇市、六盘水市（六枝特区、盘州市、水城区、钟山区）、安顺市（西秀区、平坝区、普定县、镇宁自治县、紫云自治县、关岭自治县）、红花岗区、汇川区、播州区、余庆县、仁怀市、大方县、金沙县、织金县、纳雍县、威宁自治县、碧江区、江口县、玉屏自治县、石阡县、思南县、印江自治县、沿河自治县、松桃自治县、兴义市、晴隆县、安龙县、望谟县、册亨县、凯里市、黄平县、施秉县、三穗县、镇远县、岑巩县、台江县、麻江县、福泉市、贵定县、瓮安县、长顺县、龙里县、惠水县。蓝色预警，即有一定地质灾害气象风险，共有24个县（市、区）: 息烽县、修文县、桐梓县、绥阳县、正安县、道真自治县、务川自治县、凤冈县、湄潭县、七星关区、黔西市、赫章县、德江县、兴仁市、普安县、贞丰县、榕江县、雷山县、丹寨县、都匀市、荔波县、独山县、罗甸县、三都自治县。贵州省自然资源和气象部门提醒，上述各地易发生滑坡、崩塌、泥石流等各类地质灾害，请积极做好监测与防范工作。（来源：贵阳网 记者 曾秦）#贵州身边事#,,https://wx4.sinaimg.cn/large/005DIjE0gy1hf2q2tirpbj30rs0rs4aj.jpg,,,2023-06-18,微博网页版,15,4,0,"贵州发布地质灾害气象风险预警,贵州身边事",,2023-06-18 22:05:57
4914039598090373	,N5TevxWFT,【#父亲节一起看贵州村超直播# 】贵州“村超”乡村足球联赛火热进行中，足球场成为大家周末必去的打卡欢乐地。在这里有纯粹的足球快乐、有欢呼鼓舞的村民助威、有民族文化的精彩展示、有特色美食吃个不停。今天#父亲节# ，6月18日17:30开始，陪着爸爸一起看贵州“村超”直播，相聚精彩球赛。还有#全国村BA大赛6月20日在贵州揭幕# ，期待精彩！@微博区域热点 @微博热点 @榕江在线 @黔东南新闻网官方微博 @乐生活在贵州   贵州日报官微的微博直播,,,,,2023-06-18,微博直播平台,22,4,0,"父亲节一起看贵州村超直播,父亲节,全国村BA大赛6月20日在贵州揭幕","微博区域热点,微博热点,榕江在线,黔东南新闻网官方微博,乐生活在贵州",2023-06-18 17:50:01
4914036321814370	,N5T9e7C02,【#贵州闪亮的生态美景你爱了吗# 】6月18日，是#2023年贵州生态日##第7个贵州生态日# 。行走贵州大地，处处尽显生态良好之景。最佳的纬度与高度，最佳的温度与湿度，最佳的负氧离子浓度与风的速度，让人在贵州沉浸氧海、吸氧畅游！（贵州日报天眼新闻记者 熊江睿 胥芬芳 龙飘 曾田 视频素材来源/安顺市委宣传部 绥阳县委宣传部 从江县融媒体中心） 贵州日报官微的微博视频,,,"https://f.video.weibocdn.com/u0/Mtn3Odctgx086kOlHnfi01041201t12d0E010.mp4?label=mp4_720p&template=1280x720.25.0&ori=0&ps=1BThihd3VLAY5R&Expires=1687181755&ssig=OQPe5%2Fs7tV&KID=unistore,video",,2023-06-18,微博视频号,43,6,2,"贵州闪亮的生态美景你爱了吗,2023年贵州生态日,第7个贵州生态日",,2023-06-18 17:37:00
4914030798702452	,N5T0jAvU8,【#贵州闪亮的生态美景你爱了吗# 】6月18日，是#2023年贵州生态日##第7个贵州生态日# 。2022年以来，贵州以在生态文明建设上出新绩为总目标，以改善环境质量为核心，强力推进污染防治攻坚，优良生态环境优势不断巩固提升。以下，五个维度，带你了解贵州生态环境质量情况，一起来看↓↓↓（贵州日报天眼新闻记者 熊江睿 胥芬芳 龙飘 曾田 数据来源/《2022年贵州省生态环境状况公报》）,,"https://wx3.sinaimg.cn/large/005DIjE0gy1hf2hqzhel1j32w61xg7wh.jpg,https://wx3.sinaimg.cn/large/005DIjE0gy1hf2hr0oq0lj32w61xgkjm.jpg,https://wx4.sinaimg.cn/large/005DIjE0gy1hf2hr1o2e9j32w61xgx6p.jpg,https://wx2.sinaimg.cn/large/005DIjE0gy1hf2hr2jpbyj32w61xghdt.jpg,https://wx2.sinaimg.cn/large/005DIjE0gy1hf2hr3feqcj32w61xgb29.jpg",,,2023-06-18,微博网页版,0,0,1,"贵州闪亮的生态美景你爱了吗,2023年贵州生态日,第7个贵州生态日",,2023-06-18 17:15:03
4914019301067104	,N5SHM4tBm,【#贵州闪亮的生态美景你爱了吗# 】#2023年贵州生态日# 如期而至，过去一年，贵州在365天的昼与夜中，为人与自然和谐共生写下一个个生动的注脚。过往可鉴未来可期，让我们一起在#第7个贵州生态日# 的时间点上，“数”说贵州生态，一起回顾贵州闪亮的生态美景！（贵州日报天眼新闻记者 王瑶 特别鸣谢/贵州省生态环境厅）,,"https://wx3.sinaimg.cn/large/005DIjE0gy1hf2g1cujh2j30u00gy7wh.jpg,https://wx4.sinaimg.cn/large/005DIjE0gy1hf2g13h6e3g30o016okjr.gif,https://wx2.sinaimg.cn/large/005DIjE0gy1hf2g15fhimg30o016oqvb.gif,https://wx4.sinaimg.cn/large/005DIjE0gy1hf2g16mj63g30o016o4qt.gif,https://wx3.sinaimg.cn/large/005DIjE0gy1hf2g1861vig30o016onpj.gif,https://wx1.sinaimg.cn/large/005DIjE0gy1hf2g19c6x9g30o016okjp.gif,https://wx1.sinaimg.cn/large/005DIjE0gy1hf2g1ao59ng30o016o7wm.gif,https://wx4.sinaimg.cn/large/005DIjE0gy1hf2g1cjr5xg30o016ox6t.gif,https://wx1.sinaimg.cn/large/005DIjE0gy1hf2g4easw7j30wo1p84qr.jpg",,,2023-06-18,微博网页版,0,0,0,"贵州闪亮的生态美景你爱了吗,2023年贵州生态日,第7个贵州生态日",,2023-06-18 16:29:22
4913996799410422	,N5S7tDu50,【#打卡贵州多巴胺美景#】#贵州闪亮的生态美景你爱了吗# 今天是#2023年贵州生态日# ，自2017年设立“贵州生态日”以来，贵州以前所未有的力度，推进生态环境保护，生态环境质量得到历史性跃升，贵州以绝佳的生态环境，结合自身特色吸引无数游客纷至沓来。 一眼心动的多巴胺美景，贵州安排！ ,,,,,2023-06-18,微博 weibo.com,5,2,1,"打卡贵州多巴胺美景,贵州闪亮的生态美景你爱了吗,2023年贵州生态日",,2023-06-18 14:59:56
4913959418991197	,N5R9bBJ1j,【贵州省委书记徐麟：坚持规划为先、产业为要、民生为本，让贵安新区一年一个样、三年大变样。】动静贵州的微博视频 ,,,"https://f.video.weibocdn.com/u0/FO5TkIf2gx086kipX9F601041200byDe0E010.mp4?label=mp4_720p&template=720x1280.24.0&ori=0&ps=1CwnkDw1GXwCQx&Expires=1687181754&ssig=OKxAooPuXC&KID=unistore,video",,2023-06-18,微博视频号,3,2,1,,,2023-06-18 12:31:25
4913959310726872	,N5R91335K,【贵州省委书记徐麟：好人好马上贵安，好钢用在刀刃上。】动静贵州的微博视频 ,,,"https://f.video.weibocdn.com/u0/0c7oXE33gx086kimLwOY01041200cdSh0E010.mp4?label=mp4_720p&template=720x1280.24.0&ori=0&ps=1CwnkDw1GXwCQx&Expires=1687181754&ssig=ImRzUjVzgB&KID=unistore,video",,2023-06-18,微博视频号,2,1,0,,,2023-06-18 12:30:59
4913951688623399	,N5QWIAbl5,【#卫星镜头下的贵州变化#】#贵州闪亮的生态美景你爱了吗# 2017年，“贵州生态日”正式设立，这一年，全省森林覆盖率55.3%，贵州开启全力推进生态文明建设新篇章，绿水为墨执青笔。如今，全省森林覆盖率达62.81%，绿色在贵州大地喷涌而出，让我们跟随卫星镜头穿越时光。重回2017，看2017年到2023年，贵州从浅绿变深绿。（贵州日报天眼新闻记者 王瑶 数据支持/贵州省生态环境厅 贵州省环境工程评估中心 卫星（无人机）生态环境遥感应用中心）,,"https://wx1.sinaimg.cn/large/005DIjE0gy1hf28n82c8tg30mo0k0u17.gif,https://wx2.sinaimg.cn/large/005DIjE0gy1hf28nacy1xg30mo0k0npm.gif,https://wx2.sinaimg.cn/large/005DIjE0gy1hf28nci9ufg30mo0k0qvf.gif,https://wx1.sinaimg.cn/large/005DIjE0gy1hf28netwt0g30mo0k0u16.gif,https://wx1.sinaimg.cn/large/005DIjE0gy1hf28nheho8g30mo0k0b2i.gif,https://wx4.sinaimg.cn/large/005DIjE0gy1hf28nk5n5fg30mo0k0x6z.gif,https://wx2.sinaimg.cn/large/005DIjE0gy1hf28nm8curg30mo0k07wq.gif,https://wx2.sinaimg.cn/large/005DIjE0gy1hf28noc96eg30mo0k0x6y.gif",,,2023-06-18,微博网页版,13,1,1,"卫星镜头下的贵州变化,贵州闪亮的生态美景你爱了吗",,2023-06-18 12:00:42
4913725482730137	,N5L3Sbset,【#戒不掉的贵州味道# ｜#一碗小锅凉粉沸腾了安顺的夏天#】炎热的夏天，在贵州有21℃的安顺让你清凉一“夏”。这里有水雾弥漫、雄伟壮观的黄果树大瀑布，有让人不禁感叹的人工奇景坝陵河大桥、花江峡谷大桥，有甜啧啧的六马蜂糖李……还有沸腾安顺的小锅凉粉。与贵州其他粉类不同，安顺小锅凉粉闻着一股霉豆腐味，不了解的人以为是一碗“黑暗料理”，其实只要尝过就知道这是一碗让人欲罢不能的美味。在砂锅里放入豆汤，凉粉、苕粉、土豆、火腿肠、香菜、酸萝卜、肉末、豆皮、芹菜、黄豆等食材，再加入霉豆腐汁及其他调味品，用一双加长筷子不停搅和，让食材在小锅内吸满汤汁沉浸入味。砂锅传热快，散热慢，保温能力强，把食物和调料释放的味道全部包含在内，让它们尽情碰撞。另外，关火5到10分钟后，锅内食物还能保持接近沸腾的热度，是用来煮小锅凉粉的绝佳器皿。煮好以后老板娘端着这碗还在沸腾的小锅凉粉给每个等待的食客。食客们熟练地取来小碗、筷子和勺子，将小砂锅中的佐料拌匀，把食材和汤盛到小碗里，喝一口汤吃一口凉粉，让在安顺凉爽的夏天有了热烈的记忆。（贵州日报天眼新闻记者 陈祖嘉 彭瑾） 天眼新闻的微博视频,,,"https://f.video.weibocdn.com/u0/vLhw2h4Dgx086jcIguw801041200wKpY0E010.mp4?label=mp4_720p&template=1280x720.25.0&ori=0&ps=1BThihd3VLAY5R&Expires=1687181756&ssig=cW%2FLnpxuLA&KID=unistore,video",,2023-06-17,微博视频号,5,0,0,"戒不掉的贵州味道,一碗小锅凉粉沸腾了安顺的夏天",,2023-06-17 21:01:49
4913672809875496	,N5JGUFr4c,【#多彩贵州，奇味之旅#｜#遵义有条巷子既有美食还有烟火#】6月15日，“多彩贵州，奇味之旅”主题活动的美食品鉴家们走进遵义市捞沙巷。刚进巷口，食物香气迎面而来，热闹非凡，这里的每一种美食，都承载着遵义这座城市的独特味道。蛋裹辉煌、笼笼鲊、恋爱豆腐、状元蹄、羊肉粉、豆花面……这里聚集了各式各样地道的特色小吃，烹、炒、煎、炸、烤，琳琅满目。短短300米的巷子中，深藏着不少口味独特的“老字号”，夜市里的烟火气也吸引着往来的客人寻味至此，亲身感受当地的美食文化魅力。（贵州日报天眼新闻记者 卢思露 刘青） 贵州日报官微的微博视频,,,"https://f.video.weibocdn.com/u0/aPmZlNE1gx086jd9wzGw01041200P6LM0E010.mp4?label=mp4_720p&template=1280x720.25.0&ori=0&ps=1BThihd3VLAY5R&Expires=1687181756&ssig=t079tLRL2z&KID=unistore,video",,2023-06-17,微博视频号,2,2,1,"多彩贵州，奇味之旅,遵义有条巷子既有美食还有烟火",,2023-06-17 17:32:32
4913578581431036	,N5HeW60he,【#村超上的花式加油#】6月16日，贵州榕江（三宝侗寨）和美乡村足球超级联赛再次开赛，这个被称为贵州“村超”的民间足球赛持续升温。在比赛现场，由丰乐村村民组成的啦啦队，以敲打锅碗瓢盆为自己的球队加油呐喊，还炫起了“民族风”，侗族大歌、苗族芦笙舞，现场气氛一波高似一波。观众席上，数万人看球氛围火爆，不停为赛场打call！“很接地气，现场歌舞很有特色。”从广东自驾到“村超”的游客张先生说，村民也很热情，送了很多免费小吃。据了解，随着贵州“村超”持续火爆，餐饮、住宿、超市等消费需求也在同步增长。数据显示，便利店、水果店等本地商铺的即时零售订单量也较上周同期增长，因“超级星期六足球之夜”的带动，榕江县在大众点评、美团等平台的餐饮、宾馆、超市的搜索量大幅度提升。#让贵州村超火得更加猛烈#（贵州日报天眼新闻记者 邱胜 吴东志） 贵州日报官微的微博视频,,,"https://f.video.weibocdn.com/u0/x9V5r1GNgx086iNrizvO01041200D7MY0E010.mp4?label=mp4_720p&template=1280x720.25.0&ori=0&ps=1BThihd3VLAY5R&Expires=1687181757&ssig=27cIG7ZwEX&KID=unistore,video",,2023-06-17,微博视频号,19,2,3,"村超上的花式加油,让贵州村超火得更加猛烈",,2023-06-17 11:18:06
4913543792820710	,N5GkPbPNk,【直播丨癸卯端午扒龙船，大型游江活动等你来嗨！】这几天铜仁锦江河上龙舟热身赛、游江彩排活动相继上演，简直燃爆了！就在6月17日，上演2023年中国龙舟公开赛（贵州·铜仁·碧江站）暨中国传统龙舟大赛大型游江活动，届时，在铜仁锦江河畔将上演三江六岸百舸争流！万人互动唱跳摆手舞、舞龙、中国鼓、扭龙表演等相继上演！贵州日报天眼新闻将联合铜仁市融媒体中心、碧江区融媒体中心，省市区三级联动直播，为您带来现场盛况！游江河段：瓦窑河—西门桥—兴市桥—铜岩—锦江大桥—东门桥—水晶阁大桥—大明边城龙舟基地直播时间：2023年6月17日 9:00-12:30（贵州日报天眼新闻记者 杨凯茗 周麟宇 田芳 安刚 任琳 铜仁市融媒体中心 碧江区融媒体中心）  贵州日报官微的微博视频,,,"https://live.video.weibocdn.com/3d93d544-4d17-48ea-90ca-12a2b73916e6_index.m3u8?ori=0&ps=1BThihd3VLAY5R&Expires=1687181763&ssig=1bqEg4p2u5&KID=unistore,video",,2023-06-17,微博直播平台,7,0,1,,,2023-06-17 08:59:52
4913331884789169	,N5AP2k5SF,【最新！2023年 #贵阳市义教招生划片范围出炉#】近日，贵阳市招生考试管理中心发布最新2023年贵阳市义教招生划片范围，一起来看↓↓↓#贵阳身边事# （来源：贵阳市招生考试管理中心、黔学帮） ,,"https://wx1.sinaimg.cn/large/005DIjE0gy1hf07o3xbesj30w3cn3e82.jpg,https://wx3.sinaimg.cn/large/005DIjE0gy1hf07o5u0rjj30zk6ymkjl.jpg,https://wx2.sinaimg.cn/large/005DIjE0gy1hf07o7scyyj30xncn3x6p.jpg,https://wx1.sinaimg.cn/large/005DIjE0gy1hf07o9nemjj30zk6v87wh.jpg,https://wx2.sinaimg.cn/large/005DIjE0gy1hf07ob4y7nj30skcn3u0x.jpg,https://wx1.sinaimg.cn/large/005DIjE0gy1hf07oc5w3xj30zk1sagx1.jpg,https://wx3.sinaimg.cn/large/005DIjE0gy1hf07oclmoqj30zk0viaef.jpg,https://wx2.sinaimg.cn/large/005DIjE0gy1hf07oefz4zj30zk5pz4qp.jpg,https://wx4.sinaimg.cn/large/005DIjE0gy1hf07ofs5h7j30zk1qdtl6.jpg,https://wx1.sinaimg.cn/large/005DIjE0gy1hf07oh33mbj30zk0v6dnl.jpg,https://wx2.sinaimg.cn/large/005DIjE0gy1hf07oit0jqj30zk2m8qmi.jpg,https://wx2.sinaimg.cn/large/005DIjE0gy1hf07okmxcbj30zk1r6qff.jpg,https://wx2.sinaimg.cn/large/005DIjE0gy1hf07oolbepj30vycbse82.jpg,https://wx2.sinaimg.cn/large/005DIjE0gy1hf07oq6qluj30zk3r5nhw.jpg,https://wx2.sinaimg.cn/large/005DIjE0gy1hf07osas4pj30zk5i3e81.jpg,https://wx2.sinaimg.cn/large/005DIjE0gy1hf07ouhfbxj30zk5j3wy2.jpg",,,2023-06-16,微博网页版,17,3,10,"贵阳市义教招生划片范围出炉,贵阳身边事",,2023-06-16 18:57:49
