id,bid,正文,头条文章url,原始图片url,视频url,位置,日期,工具,点赞数,评论数,转发数,话题,@用户
4902101166329174	,N0SEYqyvs,【#贵阳一公交车上配有自助售卖机# 获乘客好评！】近日，贵州贵阳。搭乘K236公交车的肖女士没来得及吃早餐，突发低血糖，幸好车上有自助售卖机。“赶紧买了牛奶和面包吃，感觉好多了！”肖女士表示，希望其他线路较长的公交车也能考虑配一个这样的售卖机。“这个自助售卖机是今年2月12日正式投用的，属于试运行，目前全市仅此一台。”贵阳公交金阳分公司二车队负责人丁小利介绍，K236公交车因为行驶路线较长，常有乘客出现低血糖的情况，所以尝试投放一台自助售卖机，便于乘客路上“补给”。“接下来，我们还计划摆放雨伞或一次性雨衣。”丁小利说。“以前坐车口渴只能忍着，现在方便多了。”乘客王先生认为公交车上配自助售卖机值得推广。对此，公交公司表示，会根据使用情况以及乘客反馈决定。（来源：贵阳新闻网、网友视频 剪辑/黄国平）#贵州身边事##贵阳身边事# @微博区域热点 贵州日报官微的微博视频,,,"https://f.video.weibocdn.com/u0/bqjK5KSRgx085uhpAej6010412006nkr0E010.mp4?label=mp4_720p&template=720x1280.24.0&ori=0&ps=1BThihd3VLAY5R&Expires=1687182054&ssig=XzPdE4JX1K&KID=unistore,video",,2023-05-16,微博视频号,7,3,1,"贵阳一公交车上配有自助售卖机,贵州身边事,贵阳身边事",微博区域热点,2023-05-16 19:10:57
4902084879586102	,N0SeHEdMy,【#5月16日24时起贵州成品油价格下调# 】贵州省发展和改革委员会5月16日消息，根据国家成品油价格形成机制，国家发展改革委决定自2023年5月16日24时起下调国内成品油价格。按照国家调整要求和相关规定，贵州省89#汽油（国VIB）、0#柴油价格每吨在现行标准基础上分别降低380元和365元，具体价格可由各经营企业在不超过最高批发、零售价格的前提下确定。☞调整后各油品最高价格见下图↓（来源：贵州省发改委）#贵州身边事#油价,,"https://wx2.sinaimg.cn/large/005DIjE0gy1he0d30niasj30mb0gv79o.jpg,https://wx2.sinaimg.cn/large/005DIjE0gy1he0d30fz3kj30pj0h2464.jpg",,,2023-05-16,微博网页版,13,4,1,"5月16日24时起贵州成品油价格下调,汽油（国VIB）、0,贵州身边事",,2023-05-16 18:06:14
4902059784278197	,N0RAehWXb,【#贵南高铁已进入逐级提速试验阶段# 】记者从中国铁路南宁局集团有限公司获悉，5月16日8时20分，55524次综合检测列车“黄医生”驶出广西南宁东站，标志着贵南高铁联调联试进入逐级提速试验阶段，为全线年内顺利开通做好充足准备。贵南高铁正线全长482公里，最高设计时速350公里。联调联试使用CRH380AJ-0203高速综合检测列车（因车身涂装醒目的黄色而被称为“黄医生”）在区间正线上，按照检测计划以时速180公里至385公里之间各个速度级往返开行。按照当天工作计划，“黄医生”以时速180公里的速度级，在南宁东站至荔波站区间正线运行，对贵南高铁沿线轨道、信号、通信、电务、综合接地等多个设备项目进行检测。综合检测列车“黄医生”逐级提速过程中，测试列车各区段最高运行速度不应超过该区段线路允许速度的110%，因此贵南高铁最高检测速度将达到每小时385公里，这有如新型飞机、大型军舰定型前的试飞、试航。（来源：央视新闻）#坐着高铁来贵州##广西身边事#,,"https://wx3.sinaimg.cn/large/005DIjE0gy1he0aweh053j31jk1127wh.jpg,https://wx4.sinaimg.cn/large/005DIjE0gy1he0awevc22j31r80zkqht.jpg,https://wx1.sinaimg.cn/large/005DIjE0gy1he0awdst4ij30y60mo7wh.jpg",,,2023-05-16,微博网页版,36,7,1,"贵南高铁已进入逐级提速试验阶段,坐着高铁来贵州,广西身边事",,2023-05-16 16:26:31
4902038661761377	,N0R2a7odj,【#贵阳气温将开始飙升# 】5月16日，记者从贵阳市气象台获悉，今天开始全市各地气温开始飙升，未来几天日最高气温在27℃之间。冷空气逐渐减弱后，贵阳贵安气温就缓慢回升，近几日午后贵阳市各地气温回升到20℃以上。需要注意的是，本周中后期可能出现雷雨天气，预计19至20日将出现一次明显降雨天气过程局部将出现强对流天气，相关部门要抓住降水时机增加水库蓄水。具体预报为：16日夜间到17日白天，多云间晴，主城区气温16～27℃；17日夜间到18日白天，多云，主城区气温18～28℃；18日夜间到19日白天，多云间阴天有阵雨或雷雨，主城区气温18～26℃。（via.甲秀新闻）,,https://wx3.sinaimg.cn/large/005DIjE0gy1he08gjx98bj30dw083dhu.jpg,,,2023-05-16,微博网页版,19,4,1,贵阳气温将开始飙升,,2023-05-16 15:02:35
4902018874084771	,N0Qwfh8Dp,【#德国小伙称折耳根蘸水是勇敢蘸水# 】近日，德国小伙@5吴雨翔 在社交媒体发布打卡贵阳美食视频，网友们纷纷抛出在线食用说明。在吃酸汤鱼时，吴雨翔尝试起折耳根蘸水，尝完称折耳根蘸水是勇敢的蘸水 （视频剪辑：贵州日报天眼新闻记者 胡蓉） 天眼新闻的微博视频 ,,,"https://f.video.weibocdn.com/u0/8uGSM8yogx085tLWvxsI010412009Sg60E010.mp4?label=mp4_720p&template=720x1280.24.0&ori=0&ps=1CwnkDw1GXwCQx&Expires=1687182055&ssig=zG%2FgA9OZdA&KID=unistore,video",,2023-05-16,微博视频号,8,1,1,德国小伙称折耳根蘸水是勇敢蘸水,5吴雨翔,2023-05-16 13:43:57
4901994533229563	,N0PSZdy9J,【#我登上了世界第一高桥# 花江大峡谷之上的王者】人，有多渺小？在地球裂缝面前，几乎看不到身影。人，有多伟大？跨越这条裂缝，突破人类极限。你可知，又一座世界第一高桥正在贵州崛起，向云霄发出新的挑战。#从565到625能超越贵州的只有贵州# （贵州日报天眼新闻记者 田旻佳 综合整理；资料来源：新华社、天眼新闻、《桥梁》杂志、贵州省地矿局官网） 贵州日报官微的微博视频,,,"https://f.video.weibocdn.com/u0/i8GuUU6Ogx085tOjwlaE01041200fkum0E010.mp4?label=mp4_720p&template=1280x720.25.0&ori=0&ps=1BThihd3VLAY5R&Expires=1687182055&ssig=GDqy9ZcwTf&KID=unistore,video",,2023-05-16,微博视频号,19,5,1,"我登上了世界第一高桥,从565到625能超越贵州的只有贵州",,2023-05-16 12:07:14
4901977266062646	,N0Pr8praC,【#乘高铁驶进贵州乡村美景# 】中国阳明文化园、桃源河旅游景区、天生桥、红色布依村寨大木村、修文猕猴桃……#坐着高铁来贵州# 自贵阳市修文县高铁站开通后，每年避暑季，重庆、长沙、武汉等地的客人都会坐着高铁来避暑赏景。据不完全统计，“五一”假期，修文县共接待游客63万人次，实现旅游综合收入31624.88万元，同比增长42.39%和63.78%。#沿着高铁看贵州# 随着高铁开通后，游客出行更加便捷，‘快旅慢游’的旅游架构正逐步形成。今年‘五一’期间，修文高铁站客流量同比增长120%。（贵州日报天眼新闻记者 刘娟） 贵州日报官微的微博视频,,,"https://f.video.weibocdn.com/u0/O4KgEEptgx085tJBeF44010412015TqJ0E010.mp4?label=mp4_720p&template=1280x720.25.0&ori=0&ps=1BThihd3VLAY5R&Expires=1687182056&ssig=ajRJRfbr18&KID=unistore,video",,2023-05-16,微博视频号,14,4,1,"乘高铁驶进贵州乡村美景,坐着高铁来贵州,沿着高铁看贵州",,2023-05-16 10:58:37
4901953455263354	,N0OOJm5eO,【#贵州工业经济加力提速提质# 】#扎实抓好主题教育之贵州答卷#近日，贵州36家上市公司陆续发布2022年年度报告，其中，以中伟股份、振华新材、安达科技等为代表的新能源电池及材料产业3家上市公司在2022年实现营业总收入508.37亿元，同比大幅增长87.14%。新能源电池及材料等战略性新兴产业是贵州工业发展的新赛道，也是推动工业经济升级的方向。2015年6月，习近平总书记视察贵州时，要求贵州推动新型工业化、新型城镇化、农业现代化、旅游产业化四个轮子一起转。#新时代新征程新伟业#今年以来，省委主要领导在深入基层调研、主持召开会议时多次强调，要“加快推进新型工业化”，“依托资源优势做大工业主导产业”，“推动新能源电池及材料、数字经济等战略性新兴产业加快壮大”。（贵州日报天眼新闻记者 江婷婷） 贵州工业经济加力提速提质 ,,,,,2023-05-16,微博 weibo.com,14,3,1,"贵州工业经济加力提速提质,扎实抓好主题教育之贵州答卷,新时代新征程新伟业",,2023-05-16 09:24:00
4901945560536069	,N0OC02fsh,【#有一种限定美好叫初夏#】初夏的浪漫有多少种样子？这些2023限定款美好，值得收藏！路边花海、双色莲花、星河灿烂、太空快递……#60秒打卡惊艳了初夏的浪漫#↓↓ 人民日报的微博视频 ,,,"https://f.video.weibocdn.com/o0/n0Wg52I9lx085tvYzrvO01041200O73l0E010.mp4?label=mp4_720p&template=1280x720.25.0&ori=0&ps=1CwnkDw1GXwCQx&Expires=1687182055&ssig=dcyuzsaKxf&KID=unistore,video",,2023-05-16,微博视频号,0,0,0,"有一种限定美好叫初夏,60秒打卡惊艳了初夏的浪漫",,2023-05-16 08:52:38
4901766506486406	,N0JXcrdps,【#贵阳市2023年中考时间确定# 】近日，贵阳市教育局印发《贵阳市2023年初中学业水平考试与高中招生工作方案》，明确贵阳市2023年中考时间为6月24日-26日。全市高中阶段学校招生依据初中学业水平考试成绩、初中生综合素质评价结果等，采取学生网上填报志愿、高中阶段学校分批次平行录取的方式进行。☞详细如下：今年招生政策有这些变化↓（来源：贵阳市教育融媒体中心 ）#贵州身边事##贵阳中考# @微博区域热点 @微博校园 @贵阳校园 @贵阳市教育局,,https://wx3.sinaimg.cn/large/005DIjE0gy1hdzeuawpb3j30y86h2x6q.jpg,,,2023-05-15,微博网页版,23,7,9,"贵阳市2023年中考时间确定,贵州身边事,贵阳中考","微博区域热点,微博校园,贵阳校园,贵阳市教育局",2023-05-15 21:01:08
4901736886833798	,N0JbqsFMy,【#贵州高铁沿线AI画每一帧都如壁纸# 】#坐着高铁来贵州# 俯瞰多彩贵州，一条条高铁线，像涌动的脉搏，一列列动车组，迎着朝阳驶向远方。让我们跟随AI的视角，沿着贵州高铁的轨道，去看一看贵州山地公园省、吹一吹多彩贵州风，在“高速平原”上激情奔赴，纵情领略山水共美的诗和远方！（贵州日报天眼新闻记者 安刚 徐玥 彭舒姗 视频图片部分素材来源于网络）#贵州身边事# 贵州日报官微的微博视频,,,"https://f.video.weibocdn.com/u0/ddB4hReggx085sG0j6EM01041200Zx5g0E010.mp4?label=mp4_720p&template=1280x720.25.0&ori=0&ps=1BThihd3VLAY5R&Expires=1687182057&ssig=ecPjgAYqBA&KID=unistore,video",,2023-05-15,微博视频号,66,8,12,"贵州高铁沿线AI画每一帧都如壁纸,坐着高铁来贵州,贵州身边事",,2023-05-15 19:03:26
4901696771461084	,N0I8J685S,【#贵州雕塑家作品登上纽约时代广场大屏# 】日前，贵州雕塑家李钢的作品《中国孔子》《知行阳明》和《北极悲歌》在纽约时代广场大屏幕上滚动展播，吸引当地居民观看。李钢说，作为贵州人，他努力创作体现中华文化精髓、符合世界进步的作品，以鲜明的中国风格向世界讲好贵州故事、中国故事和人类故事。李钢说，2016年在麻州大学波士顿孔子学院讲学期间，他发现国外教师、学生对孔子为代表的中国文化充满兴趣。孔子是中国文化的符号，王阳明则是儒家思想改良者、实践者，《中国孔子》《知行阳明》两个作品所传达的正是“世界大同、和合共生”“兼济天下而非独善其身”的中华文化理念。另一个作品冰雕《北极悲歌》则是以慢慢融化的北极熊冰雕造型，传递出对地球变暖的忧思，以期引起公众对环境的关注。（来源：多彩贵州网讯 记者 郭红宇）@贵州省文化和旅游厅 @微博国际 @微博区域热点 #贵州身边事#孔子,,"https://wx3.sinaimg.cn/large/005DIjE0gy1hdz56e3742j30iv0go7aw.jpg,https://wx1.sinaimg.cn/large/005DIjE0gy1hdz56eewgcj30il0godi4.jpg,https://wx2.sinaimg.cn/large/005DIjE0gy1hdz56enrr5j30il0go0vk.jpg",,,2023-05-15,微博网页版,22,5,0,"贵州雕塑家作品登上纽约时代广场大屏,贵州身边事","贵州省文化和旅游厅,微博国际,微博区域热点",2023-05-15 16:24:02
4901686550201248	,N0HSf0QlW,【#贵州村FA再出圈#】“村BA”之后“村FA”又来上分，网友：论氛围还得是贵州。 #贵州村FA太嗨了#5月13日贵州榕江，榕江（三宝侗寨）和美丽乡村足球超级联赛开幕。由当地群众组成的20支乡村足球队汇聚一堂进行激烈角逐，比赛从5月13日开始，持续到今年8月。据悉，榕江乡村足球赛由来已久。上世纪90年代，村民们在河边的草地上踢球比赛。本次足球联赛的奖品也十分接地气，每场比赛获胜队伍奖励猪脚2只，第一名奖品：本地小黄牛；第二名奖品：本地猪；第三名奖品：小香羊；第四名奖品：本地鹅。（via.榕江县融媒体中心；视频：黄国平） 贵州日报官微的微博视频,,,"https://f.video.weibocdn.com/u0/VMnQXWqVgx085ssgI7YA01041200f46l0E010.mp4?label=mp4_720p&template=720x1280.24.0&ori=0&ps=1BThihd3VLAY5R&Expires=1687182057&ssig=CbXiUDABGr&KID=unistore,video",,2023-05-15,微博视频号,22,4,5,"贵州村FA再出圈,贵州村FA太嗨了",,2023-05-15 15:43:25
4901666158022064	,N0HllxEU8,【#贵阳女孩匈牙利夺银# 】北京时间5月12日晚，在2023年皮划艇世界杯匈牙利站女子200米双人划艇决赛中，来自贵州的皮划艇静水女将帅常文，搭配福建林文君，代表中国队出战，以44秒77的成绩收获一枚银牌。生于2000年的帅常文，来自贵阳市花溪区。2013年，帅常文通过贵阳市体育中学水上项目教练选拔招生，进入贵阳市水上项目（皮划艇）队进行启蒙训练，开始专业运动员的训练生涯。2018年初，贵州省皮划艇静水队划艇组成立，帅常文走上了划艇之路。经过3年的刻苦训练和不断历练，在2021年9月23日，帅常文夺得了第十四届全国运动会皮划艇静水女子200米单人划艇冠军。在2022年皮划艇（静水）世锦赛女子200米双人划艇、2022年国际皮划艇联合会青少年及U23皮划艇静水世界锦标赛女子200米单人划艇比赛中，帅常文夺得银牌。（贵州日报天眼新闻记者 陶庆；视频：黄国平） 贵州日报官微的微博视频,,,"https://f.video.weibocdn.com/u0/CUMvZVofgx085ssxfdXG010412001BSm0E010.mp4?label=mp4_ld&template=360x624.24.0&ori=0&ps=1BThihd3VLAY5R&Expires=1687182058&ssig=17vmAhBQqx&KID=unistore,video",,2023-05-15,微博视频号,19,5,1,贵阳女孩匈牙利夺银,,2023-05-15 14:22:23
4901653398159856	,N0H0LyeKA,【#在沪昆高铁领略多彩贵州# 】#坐着高铁来贵州#  沪昆高铁贵州段横跨贵州东西两端，东起铜仁市、西至六盘水市，途经黔东南、贵阳、安顺等市州，是国家“八纵八横”高速铁路主通道之一。#沿着高铁看贵州#沪昆高铁贵州段站站有美景、处处有美食，乌蒙大草原、黄果树瀑布、青岩古镇、西江千户苗寨、杉木河漂流、梵净山……一众美景让游客流连忘返；盘州牛肉、安顺裹卷、青岩猪脚、凯里酸汤鱼、侗乡油茶……万千美食让大家赞不绝口。沿着沪昆高铁，便能在穿山越岭中走遍最美多彩贵州，尝遍各具特色的贵州美食。（贵州日报天眼新闻记者 聂建云）#重庆游客来贵州买避暑房#,,https://wx2.sinaimg.cn/large/005DIjE0gy1hdz07vqdz8j30mpcn11l1.jpg,,,2023-05-15,微博网页版,16,3,2,"在沪昆高铁领略多彩贵州,坐着高铁来贵州,沿着高铁看贵州,重庆游客来贵州买避暑房",,2023-05-15 13:31:41
4901629310273125	,N0GnV193f,#重庆游客来贵州买避暑房#【#高铁拓宽发展贵州新风景# 】“凉爽的气候、便利的交通，是我选择在桐梓买房避暑的重要原因。”#坐着高铁来贵州#  5月10日，重庆市民蔺志宏正在遵义市桐梓县购买的避暑房内打扫卫生、办理网线，准备着炎热时候前来避暑度假。素有“重庆后花园”之称的桐梓县，平均海拔1100米，生态好，环境美，凉爽宜居，被评为全国十佳最美揽夏地。桐梓年平均气温15℃，夏季平均气温只有25℃，是休闲避暑、旅游养生的首选之地。高铁的开通，为桐梓县的旅游发展带来了新的活力，也为“候鸟”归来带来极大便利。#沿着高铁看贵州#路通百业兴，高铁的开通为当地人的出行方式带来更多选择，也为外地人前来投资发展、避暑旅游、探亲访友等带来了便利，不仅拉近了时间距离，还促进了当地的发展。（贵州日报天眼新闻记者 娄勤丽；部分视频素材来源 桐梓县融媒体中心） 贵州日报官微的微博视频,,,"https://f.video.weibocdn.com/u0/EqjeQzuRgx085scE9xXW01041201h5Kd0E010.mp4?label=mp4_720p&template=1280x720.25.0&ori=0&ps=1BThihd3VLAY5R&Expires=1687182058&ssig=Lu5zyC%2BMmA&KID=unistore,video",,2023-05-15,微博视频号,9,3,0,"重庆游客来贵州买避暑房,高铁拓宽发展贵州新风景,坐着高铁来贵州,沿着高铁看贵州",,2023-05-15 11:55:58
4901606518687869	,N0FN9As6V,#扎实抓好主题教育之贵州答卷#【牢牢守好发展和生态两条底线｜贵州全力以赴在生态文明建设上出新绩】2021年春节前夕，习近平总书记视察贵州，强调优良生态环境是贵州最大的发展优势和竞争优势，要求贵州在生态文明建设上出新绩。2022年，《国务院关于支持贵州在新时代西部大开发上闯新路的意见》（国发〔2022〕2号文件）出台，赋予贵州“四区一高地”战略定位，为贵州高质量发展注入新动力。其中，“生态文明建设先行区”的战略定位，确定了贵州推进生态文明建设新的历史坐标。#新时代新征程新伟业#嘱托，声声入耳；前行，步步生风。当前，贵州正深入开展学习贯彻习近平新时代中国特色社会主义思想主题教育，努力在贯彻落实习近平总书记重要讲话和重要指示批示精神上取得新进展、新成效。（贵州日报天眼新闻记者 尚宇杰） 牢牢守好发展和生态两条底线｜贵州全力以赴在生态文明建设上出新绩,,,,,2023-05-15,微博 weibo.com,1,0,1,"扎实抓好主题教育之贵州答卷,新时代新征程新伟业",,2023-05-15 10:25:24
4901588935903321	,N0FkNoLIR,【#贵州建设大通道服务双循环#】不沿海、不沿江、不沿边，贵州如何成为对外开放的前沿和窗口？借力西部陆海新通道建设，贵州正迎来对外开放提速发展新机遇。（贵州日报天眼新闻记者 冯倩）#只争朝夕凝心聚力# #贵州抓落实促发展# 贵州省抢抓西部陆海新通道建设机遇，积极服务和融入新发展格局 ,,,,,2023-05-15,微博 weibo.com,18,5,2,"贵州建设大通道服务双循环,只争朝夕凝心聚力,贵州抓落实促发展",,2023-05-15 09:15:32
4901581445662492	,N0F8InL4w,【果然是重庆！#大熊猫组局吃九宫格火锅#】#这火锅吃完锅还能保住吗#近日，重庆动物园为大熊猫“双重”“喜庆”安排了一顿“九宫格火锅”。竹子编制的“九宫格火锅”里有西瓜、竹笋、胡萝卜等美食。萌宝们围坐一圈，边吃“火锅”边喝“饮料”，眯眼享受着幸福的美食光景。网友：竹子做的锅，大熊猫会不会把锅也吃了啊。@央视网 央视网的微博视频,,,"https://locallimit.us.sinaimg.cn/o0/APle88GHlx085qTshsFW01041200bkPv0E010.mp4?label=mp4_720p&template=1280x720.25.0&ori=0&ps=1BThihd3VLAY5R&Expires=1687182059&ssig=7od0cNsOnP&KID=unistore,video",,2023-05-15,微博视频号,6,3,0,"大熊猫组局吃九宫格火锅,这火锅吃完锅还能保住吗",央视网,2023-05-15 08:45:46
4901389261865108	,N0A8K7Pco,【#在北京餐桌上吃到精美贵州天麻宴# 】#戒不掉的贵州味道# 近日，“黔货在京·贵天麻”北京推介会上，贵州优质天麻经过“七十二变”，在北京餐桌演绎出精妙绝伦的黔韵风味。这场“天麻宴”中，既有天麻盗汗鸡、天麻炖黑山羊肉、鲜天麻炒火腿这样的传统天麻菜式搭配，也有天麻焗雪花牛肉、烧椒鲜天麻、天麻煎鸡蛋、凉拌天麻丝、桂花鲜天麻等探索性尝试，还有拔丝天麻、翡翠天麻、果味鲜天麻、爆芹炒鲜天麻等创意之品，从选材到入味，从制作到装盘，都颇具匠心。黔贵大地独特的气候条件和生态环境，孕育了高品质天麻，从深山，到餐桌，鲜炖、入菜、火锅、凉拌，天麻养生膳食，凝结着黔人的巧思与智慧。山珍之鲜，食之让人难忘怀，嘉宾们纷纷在品鉴单上选出了心中所爱菜品。（贵州日报天眼新闻记者 陈美伊）#北京身边事# @北京发布 @北京日报 @北京青年报 @北京晚报 @北京头条 @北京人不知道的北京事儿 @吃喝玩乐在北京 @贵州省文化和旅游厅 @贵阳市文化和旅游局,,"https://wx1.sinaimg.cn/large/005DIjE0gy1hdy41p49ldj30xt0pwn61.jpg,https://wx1.sinaimg.cn/large/005DIjE0gy1hdy41pimaej30xt0ppn3u.jpg,https://wx4.sinaimg.cn/large/005DIjE0gy1hdy41pvzh2j30xt0pv0zg.jpg,https://wx4.sinaimg.cn/large/005DIjE0gy1hdy41q8wshj30xt0pidp3.jpg,https://wx4.sinaimg.cn/large/005DIjE0gy1hdy41qn658j30xt0ptdnh.jpg,https://wx3.sinaimg.cn/large/005DIjE0gy1hdy41qzwpjj30xt0pxqbi.jpg,https://wx2.sinaimg.cn/large/005DIjE0gy1hdy41rbu7fj30xt0psdn2.jpg,https://wx1.sinaimg.cn/large/005DIjE0gy1hdy41rqm2kj30xt0pxwn2.jpg",,,2023-05-14,微博网页版,20,6,2,"在北京餐桌上吃到精美贵州天麻宴,戒不掉的贵州味道,北京身边事","北京发布,北京日报,北京青年报,北京晚报,北京头条,北京人不知道的北京事儿,吃喝玩乐在北京,贵州省文化和旅游厅,贵阳市文化和旅游局",2023-05-14 20:02:05
4901331146115161	,N0yD0pEPD,【#贵州26户家庭上榜全国最美家庭名单# 】5.15#国际家庭日# 前夕，全国妇联揭晓1000户全国最美家庭，其中，贵州有26户家庭入选。这些家庭积极培育和践行社会主义核心价值观，在各行各业践行劳动精神、奋斗精神、奉献精神、创造精神、勤俭节约精神，展现了新时代家庭奋进新征程的良好精神风貌，体现了爱国爱家、相亲相爱、向上向善、共建共享的社会主义家庭文明新风尚，在传承中华民族家庭美德、厚植家国情怀、弘扬文明新风方面树立了标杆、作出了表率。（来源：全国妇联家庭和儿童工作部、中国妇女报）#贵州身边事# @微博区域热点,,"https://wx1.sinaimg.cn/large/005DIjE0gy1hdxz1rm6mgj30m80v6jyj.jpg,https://wx4.sinaimg.cn/large/005DIjE0gy1hdxz1s2ol6j30m80v6tn9.jpg,https://wx1.sinaimg.cn/large/005DIjE0gy1hdxz1sc8mgj30m80wvtch.jpg",,,2023-05-14,微博网页版,14,4,1,"贵州26户家庭上榜全国最美家庭名单,国际家庭日,贵州身边事",微博区域热点,2023-05-14 16:11:10
4901271201645751	,N0x4k6U8n,【#贵州疾控提醒初夏谨防野菜中毒# 】初夏之际，万物竞生，贵州人的餐桌上少不了一道美味佳肴——野菜。灰灰菜、蕨菜、水芹、血皮菜、鸭脚板……贵州人爱采、爱买、爱吃野菜。可是，野菜一旦没吃对，误食了有毒植物，那可就惨了。近日，兴义市的郑先生将菊三七误作血皮菜、西秀区的王先生将乌头叶误作“姨妈菜”食用，都导致了中毒事件。贵州省疾控中心提醒大家：不要采食或购买不认识、不熟悉的野菜；在采集或购买野菜时应仔细辨认，如无法准确辨识时，则不应该采集或购买食用；一旦发生疑似误采误食有毒植物中毒，应及时前往医院就诊。那贵州有哪些容易被误食的有毒植物，应如何预防有毒植物中毒呢？☞参见下图↓（来源：贵州疾控）@微博区域热点 #贵州身边事#野菜,,https://wx1.sinaimg.cn/large/005DIjE0gy1hdxpe44ai1j31453b37wj.jpg,,,2023-05-14,微博网页版,7,2,0,"贵州疾控提醒初夏谨防野菜中毒,贵州身边事",微博区域热点,2023-05-14 12:12:58
4901242759807229	,N0wkrF9j7,【#原来我记得这首歌是写给母亲的# 】带着比身体重的行李（胎盘），游入尼罗河底（羊水），经过几道闪电，看到一堆光圈（手术灯）……藏在歌曲《我记得》里的秘密，你听懂了吗？我记得，今天是#母亲节#！via. 人民日报的微博视频 ,,,"https://f.video.weibocdn.com/o0/6wgUkSvKlx085qjIYZaw01041201g91Y0E010.mp4?label=mp4_720p&template=1280x720.25.0&ori=0&ps=1CwnkDw1GXwCQx&Expires=1687182057&ssig=MZNi88NFRf&KID=unistore,video",,2023-05-14,微博视频号,8,0,1,"原来我记得这首歌是写给母亲的,母亲节",,2023-05-14 10:19:57
