id,bid,正文,头条文章url,原始图片url,视频url,位置,日期,工具,点赞数,评论数,转发数,话题,@用户
4906871285353217	,N2SKImsCd,【#湄潭男子荒山迷路七天后被找到#众人接力背他出山】5月22日，贵州遵义湄潭县兴隆镇一59岁男子，因手术后遗症导致精神恍惚，外出后走入荒山迷路，当天当地村民二十几人就开展了搜救但无果。第二天湄潭警方、蓝天救援队、村委员会及当地村民五十余人出动了无人机、 警犬对周边开展地毯式搜索，但因地势太过复杂仍无果。在没有任何线索的情况下又持续搜寻了三天，在第六天，村委会发起了倡议书，百余名爱心人士参与搜救，终于在大山深处找到了草帽与鞋子，经家属辩认是走失人员本人的。第七天下午四点，终于在大山深处找到走失男子，但男子早已体力不支，又因山路不通车，众人接力将其背出大山。经救护车送到医院进行检查后，目前男子一切平安。（湄潭公安 孙苑 贵州日报天眼新闻记者 周官霞）遵义  @贵州长安网@遵义公安 @湄潭公安 贵州日报官微的微博视频,,,"https://f.video.weibocdn.com/u0/Yd3c7Rpugx085Ph6W01201041200yQhl0E010.mp4?label=mp4_720p&template=720x1280.24.0&ori=0&ps=1BThihd3VLAY5R&Expires=1687181945&ssig=9wxVaE5eEB&KID=unistore,video",,2023-05-29,微博视频号,16,6,0,湄潭男子荒山迷路七天后被找到,"贵州长安网,遵义公安,湄潭公安",2023-05-29 23:05:42
4906787067135914	,N2QyStWno,【#遵义街头散落百元大钞#被他们捡了！】5月26日，遵义仁怀，市民蔡先生从银行取了3000元现金后，在回家途中不慎滑落全部现金并未察觉。当时，仁怀市公安局中枢派出所警员陈浪、肖懿航恰好驾车巡逻至该路段，看见路面上散落的现金后立即下车在车流中捡拾。在现金全部捡拾完后，此时察觉现金丢失的蔡先生才原路返回寻找，当他看着警员手中刚刚捡起的现金时长舒了一口气，经过现场清点核实，蔡先生丢失的3000元现金分文未少。陈浪、肖懿航现场将现金交还蔡先生后就投入到巡逻工作中。事后，蔡先生通过电话联系到仁怀市公安局，对陈浪、肖懿航两位警员表示感谢。（来源：遵义日报 视频剪辑 胡蓉） 贵州日报官微的微博视频遵义,,,"https://f.video.weibocdn.com/u0/Z8o6GkYTgx085OU86KQw010412005lie0E010.mp4?label=mp4_720p&template=720x1280.24.0&ori=0&ps=1BThihd3VLAY5R&Expires=1687181945&ssig=BpkfrISyLv&KID=unistore,video",,2023-05-29,微博视频号,23,5,1,遵义街头散落百元大钞,,2023-05-29 17:31:03
4906757342105006	,N2PMW8PBI,【#外卖小哥被压车底大家都赶来帮忙#】日前，贵州兴义桔山大道路口发生一起车祸，一名外卖小哥被卷入车底，热心市民立刻赶来抬车救人。目击者表示，有公交车上的乘客还有周边的过路司机都赶来抬车。因为当时天气比较热，有人拿了一把伞给伤者挡着，随后被送医救治。#正能量# @微博区域热点 （视频剪辑：贵州日报天眼新闻记者 胡蓉） 天眼新闻的微博视频,,,"https://f.video.weibocdn.com/u0/CFtvZ3F6gx085OGUIG3601041200aC5k0E010.mp4?label=mp4_720p&template=720x1280.24.0&ori=0&ps=1BThihd3VLAY5R&Expires=1687181946&ssig=dBcn2i5wnH&KID=unistore,video",,2023-05-29,微博视频号,1,2,0,"外卖小哥被压车底大家都赶来帮忙,正能量",微博区域热点,2023-05-29 15:32:56
4906733091160101	,N2P9P4RNj,【#贵州一中学全校合唱为高三生加油#】高考在即，近日在贵州独山高级中学，高一、高二的学生在学校楼道中手举荧光棒，齐声合唱《夜空中最亮的星》，为高三学子“喊楼”助威。#祝福2023高考生# 高考（视频剪辑：贵州日报天眼新闻记者 胡蓉） 贵州日报官微的微博视频 ,,,"https://f.video.weibocdn.com/u0/HtsJuyitgx085OFoPOr6010412005l7f0E010.mp4?label=mp4_720p&template=720x1280.24.0&ori=0&ps=1CwnkDw1GXwCQx&Expires=1687181944&ssig=hQukaYhcTt&KID=unistore,video",,2023-05-29,微博视频号,109,8,2,"贵州一中学全校合唱为高三生加油,祝福2023高考生",,2023-05-29 13:56:33
4906697342059352	,N2Oea8DJm,【#贵州茶不仅能喝更能泡#】乌龙茶、白茶、红茶……泡池里水雾氤氲，茶香四溢，让人舒适惬意。茶，不仅能喝，更能“泡”。5月1日，石阡佛顶山温泉小镇游人如织，这里的贵州首个“苔茶温泉”，成为省内外游客的打卡点。石阡“茶+旅游”融合新业态项目火爆，是贵州各地“茶+”融合新业态项目蓬勃发展的写照。围绕丰富“茶+”融合新业态做好文章，贵州各地向一二三产业融合发展要效益，“茶+旅游”“茶+电商”“茶+大数据”等融合新业态百舸争流、千帆竞渡，加出黔茶发展新动能。（贵州日报天眼新闻记者 向淳）  贵州“茶+”融出发展新风景,,,,,2023-05-29,微博 weibo.com,20,4,1,贵州茶不仅能喝更能泡,,2023-05-29 11:34:30
4906662815859487	,N2NktoAjR,#扎实抓好主题教育之贵州答卷#【聚焦推动卫生健康事业高质量发展｜贵州省卫健系统扎实开展学习贯彻习近平新时代中国特色社会主义思想主题教育】以学铸魂、以学增智、以学正风、以学促干。连日来，贵州省卫健系统参学单位扎实开展学习贯彻习近平新时代中国特色社会主义思想主题教育，坚持全面学、专题学、重点学，一篇一篇读、一段一段悟，学深悟透、入脑入心，筑牢信仰之基、补足精神之钙、把稳思想之舵，切实把主题教育学习成果转化为推动健康事业高质量发展的实际成效，不断增强人民群众看病就医获得感、幸福感、安全感。树立典型，不断凝聚发展力量。2023年健康中国大会.贵州主题会议在贵阳隆举行，全面展示健康贵州建设的新成就；贵州派出的首批援所罗门中国医疗队，以实际行动讲好中国故事，发出贵州好声音；举办全省护士岗位技能竞赛暨5.12国际护士节颁奖典礼，一大批护理先进人员获得表彰，发展护士队伍、改善护理服务……在习近平新时代中国特色社会主义思想的指引下，全省卫健系统党员干部深受鼓舞，不断凝聚起谱写卫生健康事业高质量发展新篇章、奋发有为推进中国式现代化贵州卫健实践的磅礴伟力。#新时代新征程新伟业#（贵州日报天眼新闻记者 胡家林）,,"https://wx4.sinaimg.cn/large/005DIjE0gy1heezjhv2pwj31ba0zgty3.jpg,https://wx3.sinaimg.cn/large/005DIjE0gy1heezjq9d5lj344g2mg7wk.jpg,https://wx2.sinaimg.cn/large/005DIjE0gy1heezjury0bj30qy0hmk1n.jpg",,,2023-05-29,微博网页版,1,0,0,"扎实抓好主题教育之贵州答卷,新时代新征程新伟业",,2023-05-29 09:17:19
4906652094957877	,N2N3bkNLL,【#距2023高考还有9天#，#一人一句为2023高考加油#】久久为功，将来的你，一定会感谢当年咬牙坚持的自己。愿每位考生为青春交出无悔的答卷！转发，一起#祝福2023高考生#！（记者：潘昱龙 王莹 张超帆 设计：陈为） ,,https://wx3.sinaimg.cn/large/005DIjE0gy1heeybkk4fqj31e02gwx4q.jpg,,,2023-05-29,HUAWEI P40 Pro 5G,5,2,0,"距2023高考还有9天,一人一句为2023高考加油,祝福2023高考生",,2023-05-29 08:34:43
4906494258577891	,N2IWBzZv5,【圆满落幕！#2023数博会呈现四大亮点# 】5月28日下午，2023中国国际大数据产业博览会新闻发布会召开，发布本届数博会相关情况。本届数博会秉承“全球视野、国家高度、产业视角、企业立场”的办会理念，坚持“数据创造价值 创新驱动未来”的大会主题，以“数实相融 算启未来”为年度主题，围绕“一会、一展、一发布、一大赛、一商贸洽谈”开展丰富多彩的活动。据悉，本届数博会除开幕式、闭幕式外，共举办了220余场活动；线上线下参展企业353家，其中线下参展企业328家，展出新产品、新技术、新方案900余项；发布国际国内领先科技成果20项；签约项目71个，投资金额613亿元；参会观展超过18万余人次，其中注册参会嘉宾2.14万名，专业观众9万余名，全网收看开幕式直播人数达1293万人（次），参会观展人数创历史新高，规模空前。本届数博会是一届汇聚全球大数据业界精英、引领世界大数据发展风向的行业盛会。呈现四个方面亮点——突出国际化，品牌影响持续提升。共有来自50个国家和地区的338名外宾参会，友城论坛深化合作。首次举办以国际友城为主题的专业论坛，吸引了来自10余个国家百余位嘉宾参会，其中外宾占80%。首次设置了海外联展主题展区、国际友城展区，微软、富士胶片、彭博资讯、伦敦证券交易所集团等83家国际知名企业参展。突出专业化，引领行业发展风向。论坛研讨前瞻领航 ，围绕东数西算、数据流通、人工智能大模型、工业互联网等前沿热点议题，举办了7场高端对话、26场专业论坛， 521名嘉宾发表精彩演讲，参会嘉宾1.1万余人。此外，展览展示精彩前沿，成果发布硬核亮眼。突出项目化，商贸洽谈务实丰硕。聚焦“一硬一软”两大特色产业，签约海豚数字医疗产业园、中国广电云（西南）数据中心等一批优质项目。吸引了中国互联网投资基金、招商局、中国投资等知名投资机构，以及商汤科技、海天瑞声、白山云等企业参加，实现资本产业有效对接。“爽爽贵阳电子竞技大赛”首次引入网易电竞NeXT全国总决赛、腾讯2023西南王者荣耀邀请赛两项赛事，线上线下参赛人数超100万。宣传立体化，数博声浪全球传播。实施2023数博全球传播行动，20余家媒体统一开设专题专栏。来自全球111家媒体、1400余名记者编辑对本届数博会进行了深入跟踪报道，数博会全球影响力持续提升。此外，第三届贵阳工业博览会嵌入本届数博会同期举办，更加凸显“数实相融”主题。举办“工业互联网”高端对话、“产业数字化”等4场新型工业化相关论坛，72位嘉宾分享数字赋能工业转型之道；81家工业企业集中展示新型工业化发展成就，贵州新型工业化成果展区全方位展示贵州大数据+智能制造、工业制造领域发展成就、优势潜力和发展蓝图；工业互联网大赛以数据赋能电子信息制造、磷化工、煤矿、铝加工、酱酒、生物医药等传统产业转型；开展产业合作对接，实现硬件产业签约项目21个、金额157.78亿元。（贵州日报天眼新闻记者 高伟 陈慧）#2023数博会参会观展人数创历届新高##北中关南数博一起向未来#,,"https://wx3.sinaimg.cn/large/005DIjE0gy1heeg6bcim9j30u00dvq9l.jpg,https://wx3.sinaimg.cn/large/005DIjE0gy1heeg6az504j30u00dvdme.jpg",,,2023-05-28,微博网页版,17,4,4,"2023数博会呈现四大亮点,2023数博会参会观展人数创历届新高,北中关南数博一起向未来",,2023-05-28 22:07:32
4906458250482443	,N2I0x21vl,【#北中关南数博一起向未来# 】5月25日晚，首都北京中关村，一场科技盛宴——2023中关村论坛隆重开幕。仅仅10多个小时后，5月26日上午，在2000公里之外的贵州贵阳，2023中国国际大数据产业博览会（简称“数博会”）拉开帷幕。两大盛会不期而遇，一北一南，遥相呼应，科星闪耀。在中关村论坛上冲一把科技的浪，在数博会里游一下数据的海，当是一大幸事。北“中关”，南“数博”，好戏连台，引人瞩目。其实，数博会和中关村，贵阳和北京，有段不解之缘。☞点此进入了解背后的故事↓ （贵州日报天眼新闻记者 成嘉廷 袁鹏）#2023数博会参会观展人数创历届新高# #北京身边事# @北京发布 @北京日报 @北京晚报 @北京头条  天眼观察丨北“中关”，南“数博”，一起向未来,,,,,2023-05-28,微博 weibo.com,13,4,0,"北中关南数博一起向未来,2023数博会参会观展人数创历届新高,北京身边事","北京发布,北京日报,北京晚报,北京头条",2023-05-28 19:44:27
4906416160899298	,N2GUE3LWO,【#2023数博会参会观展人数创历届新高# 】5月28日，为期3天的2023中国国际大数据产业博览会在贵州贵阳圆满闭幕。本届数博会秉承“全球视野、国家高度、产业视角、企业立场”的办会理念，坚持“数据创造价值 创新驱动未来”的大会主题，以“数实相融 算启未来”为年度主题，围绕“一会、一展、一发布、一大赛、一商贸洽谈”开展丰富多彩的活动，并同期举办贵阳工业博览会，实现成功、圆满、精彩举办。据悉，本届数博会除开幕式、闭幕式外，共举办了220余场活动；线上线下参展企业353家，其中线下参展企业328家，展出新产品、新技术、新方案900余项；发布国际国内领先科技成果20项；签约项目71个，投资金额613亿元；参会观展超过18万人次，其中注册参会嘉宾2.14万名，专业观众9万余名，全网收看开幕式直播人数达1293万人次，参会观展人数创历届数博会新高。与会嘉宾一致认为，本届数博会顶层设计有创意、办会办展有创新、展览展示有亮点、双招双引有成效，是一届汇聚全球大数据业界精英、引领世界大数据发展风向的行业盛会。（贵州日报天眼新闻记者 周梓颜 胡丽华 高伟 图/杨涛）#天眼聚焦2023数博会##贵州身边事#,,"https://wx4.sinaimg.cn/large/005DIjE0gy1hee76z327tj318g0u5k0i.jpg,https://wx2.sinaimg.cn/large/005DIjE0gy1hee76zbtzkj318g0vtgr0.jpg,https://wx4.sinaimg.cn/large/005DIjE0gy1hee76zl9roj318g0ufn5h.jpg,https://wx1.sinaimg.cn/large/005DIjE0gy1hee76zx16yj318g0umk1b.jpg,https://wx1.sinaimg.cn/large/005DIjE0gy1hee7708xtyj318g0vgn6o.jpg,https://wx1.sinaimg.cn/large/005DIjE0gy1hee770i6rrj318g0vz44e.jpg,https://wx4.sinaimg.cn/large/005DIjE0gy1hee7712lnsj318f0u2tcb.jpg,https://wx3.sinaimg.cn/large/005DIjE0gy1hee771betuj318g0u178l.jpg,https://wx1.sinaimg.cn/large/005DIjE0gy1hee771mau1j318g0uatgv.jpg,https://wx3.sinaimg.cn/large/005DIjE0gy1hee771wsyuj318g0vtdnl.jpg,https://wx1.sinaimg.cn/large/005DIjE0gy1hee77262m4j318g0uu45i.jpg",,,2023-05-28,微博网页版,17,6,6,"2023数博会参会观展人数创历届新高,天眼聚焦2023数博会,贵州身边事",,2023-05-28 16:57:11
4906389434535218	,N2Gdxj1OG,#2023数博会闭幕式直播# 【直播｜2023中国国际大数据产业博览会新闻发布会（闭幕式）】5月28日15时，2023 中国国际大数据产业博览会举行新闻发布会，发布2023中国国际大数据产业博览会及第三届贵阳工业博览会相关成果。天眼新闻、当代先锋网对新闻发布会进行图文直播，敬请关注！直播链接：网页链接 （贵州日报天眼新闻记者 田旻佳 周梓颜 陈慧)#2023数博会参会观展人数创历届新高# #2023数博会呈现四大亮点#,,https://wx4.sinaimg.cn/large/005DIjE0ly1hee45lk8yqj30uo0id41n.jpg,,,2023-05-28,HUAWEI P40 Pro 5G,4,0,0,"2023数博会闭幕式直播,2023数博会参会观展人数创历届新高,2023数博会呈现四大亮点",,2023-05-28 15:11:00
4906379700077123	,N2FXQ0k3V,【#贵州大数据首创煤矿井下全知道# 】为深入推进煤炭供给侧结构性改革，坚决淘汰落后产能，加快煤炭工业转型升级，贵州省自2017年以来便大力推进煤矿机械化、智能化升级改造。依托大数据、云计算、物联网等新一代信息技术，以及贵州大数据产业发展成果，“贵州省煤矿智能化运维服务平台”应运而生。#天眼聚焦2023数博会#  该平台依托全省实施煤矿智能机械化升级改造为基础，借助物联网数据实时采集上传技术及大数据云计算分析手段，集远程监测、数据分析、远程调度、物资管理、故障检测分析等等功能于一体，对实现贵州省煤矿生产智能化，推动贵州新型工业化发展具有重要意义。贵州省煤矿设计研究院能源大数据分院院长李晓华告诉记者：“我们的物联网数据，就整个煤炭行业来说，能够做到这么大规模，贵州在全国还是首创！”（贵州日报天眼新闻记者 杨凯茗 张绍东) 贵州日报官微的微博视频,,,"https://f.video.weibocdn.com/o0/Sk05Alhglx085N6WUkQM01041201eCuK0E010.mp4?label=mp4_720p&template=1280x720.25.0&ori=0&ps=1BThihd3VLAY5R&Expires=1687181948&ssig=YnjsSoyjmx&KID=unistore,video",,2023-05-28,微博视频号,11,3,1,"贵州大数据首创煤矿井下全知道,天眼聚焦2023数博会",,2023-05-28 14:32:19
4906364113519966	,N2FyHeLHE,【#贵州高校以数字点亮职教未来# 】5月27日，2023中国国际大数据产业博览会在贵阳持续开展中，记者在贵州电子信息职业技术学院展厅看到了校企合作研发的打火机高速自动插盘机。#天眼聚焦2023数博会# 该设备通过高速视觉移动定位，实现产品的自动经运输、自动检测、自动识别、自动排列，提升打火机插排生产效率，不仅降低了人工服务的成本，提高了工作效益，更能避免人工因误造成的不良因素。目前该设备正处于第一代产品的试用阶段，其工作效率已经达到同行业领先水平。据了解，贵州电子信息职业技术学院一方面依托专业特色优势，联合企业组建智能制造技术研究中心，建立优势互补、风险共担、利益共享的产学研用合作机制，推动各类创新主体协同合作，提升重大关键装备和高端新型装备技术服务能力。（贵州日报天眼新闻记者 黄弘 李硕 邱胜  谢佳杰) 天眼新闻的微博视频,,,"https://f.video.weibocdn.com/o0/QAn1hNK7lx085MO9Ukow01041200tViB0E010.mp4?label=mp4_720p&template=1280x720.25.0&ori=0&ps=1BThihd3VLAY5R&Expires=1687181948&ssig=jGbWCXb1qI&KID=unistore,video",,2023-05-28,微博视频号,2,0,0,"贵州高校以数字点亮职教未来,天眼聚焦2023数博会",,2023-05-28 13:30:23
4906316147720265	,N2Ejkwoop,【#2023数博会停车指南# 】2023中国国际大数据产业博览会将于今天落下帷幕。今天是公众开放日，参观时间为上午9:00至下午16:00，据悉， 61000张免费展览门票已全部预约完毕。#天眼聚焦2023数博会# 从昨天（5月27日）会场周边的车流量来看，由于工作人员、展商、嘉宾、游客等集中前往贵阳国际会议展览中心，会场沿线道路交通量陡增，沿线路网交通压力增大。预测今天（5月28日）贵阳国际会议展览中心周边车流依旧高位运行，特别是林城东路、会展北路、会展东路、会展南路、长岭北路、观山东路、金朱东路、中天路等路段交通将受到影响。尤其是9点之前、中午12点前后以及下午4点之后这三个时间段，市民出行集中，交通压力最大。双核通道上的快速车流会迅速在金融城路口、会展城路口、美的路口、会展北路与会展东路交叉口排队，形成高峰节点性的拥堵。从互联网交通数据来看，届时进入会场的车流从上述路口经过，会增加一定的延误时间。对此，贵阳交警将继续全警上路，在观山东路、黔灵山路、西二环、北二环、林城东路、金朱东路等通往数博会主会场的道路上针对性进行警力部署，增加巡逻频次，加强交通疏导，全力保畅。（via.贵阳交警),,"https://wx1.sinaimg.cn/large/005DIjE0ly1hedxb9fjetj30xc1k1akx.jpg,https://wx3.sinaimg.cn/large/005DIjE0ly1hedxb8u3gbj30xc46ue31.jpg",,,2023-05-28,HUAWEI P40 Pro 5G,10,3,0,"2023数博会停车指南,天眼聚焦2023数博会",,2023-05-28 10:19:46
4906294177169569	,N2DJTu58d,#扎实抓好主题教育之贵州答卷# 【以学铸魂 实干担当丨全省群团组织扎实开展学习贯彻习近平新时代中国特色社会主义思想主题教育】学深悟透增本领，担当作为重实效。连日来，全省群团组织牢牢把握“学思想、强党性、重实践、建新功”总要求，精心组织、周密安排、迅速行动，推进学习贯彻习近平新时代中国特色社会主义思想主题教育有力有序开展。学习过程中坚持学思用贯通、知信行统一，切实把学习成效转化为锐意进取、担当有为的精神状态，转化为做好本职工作、推动事业发展的生动实践，转化为奋进新征程、建功新时代的务实行动。全文链接：网页链接（贵州日报天眼新闻记者 韦倩),,https://wx2.sinaimg.cn/large/005DIjE0ly1hedt7mw30ij30k00b9myg.jpg,,,2023-05-28,HUAWEI P40 Pro 5G,2,0,2,扎实抓好主题教育之贵州答卷,,2023-05-28 08:52:28
4906077688170329	,N2y6Iyhtv,【#胡锡进站在坝陵河大桥感慨贵州发展# 】“我现在在贵州省，这是坝陵河大桥，贵州省可以说是全世界桥梁最密集的地方，有各种各样的桥，可以叫世界的‘桥梁博物馆’。”@胡锡进 在一个极特殊神奇的点位，做了一期难忘的视频，为贵州点赞：贵州正迅速地迈向现代化，朝着现代化前进，为贵州的发展骄傲，祝愿贵州越来越好！（素材来源：@胡锡进 微博 视频剪辑/黄国平）#胡锡进现身贵阳参加数博会# 贵州日报官微的微博视频,,,"https://f.video.weibocdn.com/u0/Q1KB8dHtgx085LMy99Kg01041200cYqC0E010.mp4?label=mp4_720p&template=720x1280.24.0&ori=0&ps=1BThihd3VLAY5R&Expires=1687181950&ssig=%2B7cZ%2BqCl4w&KID=unistore,video",,2023-05-27,微博视频号,8,3,2,"胡锡进站在坝陵河大桥感慨贵州发展,胡锡进现身贵阳参加数博会","胡锡进,胡锡进",2023-05-27 18:32:14
4906047791173046	,N2xkv4Va6,【#2023数博会十佳大数据案例揭晓# 】#贵州从聚数到算数心里有数# 5月27日，大数据产业发展系列研究成果发布会暨数博会“十佳大数据案例”揭晓活动在贵阳举行。会上揭晓了2023数博会“十佳大数据案例”，包括：•贵州航天云网科技有限公司的工业互联网多源异构数据融通治理平台•国能铁路装备有限责任公司的基于数据治理的重载铁路数字产业化流通解决方案•浪潮云信息技术股份公司的一体化大数据平台•联通数字科技有限公司的金融区块链共享平台（金易链）•奇安信科技集团股份有限公司的基于数据沙箱技术的数据安全流通平台•三一汽车起重机械有限公司的智慧运营赋能吊装行业•一汽解放汽车有限公司的基于工业互联网的高端中重卡智能工厂大数据融合创新应用•中国交通信息科技集团有限公司的集团型企业智慧运营决策一体化平台关键技术研究与应用•中铁十一局集团城市轨道工程有限公司的基于大数据的盾构数字化施工和盾构再制造创新应用•中兴通讯股份有限公司的基于大数据技术的面向金融交易场景的数据库产品及在工商银行的应用等十项大数据案例。 #天眼聚焦2023数博会# （贵州日报天眼新闻记者 文/管云 图/李森）,,"https://wx4.sinaimg.cn/large/005DIjE0gy1hed0wgvpy8j30k00bjta6.jpg,https://wx3.sinaimg.cn/large/005DIjE0gy1hed0wh0c22j30k00adq41.jpg",,,2023-05-27,微博网页版,21,5,3,"2023数博会十佳大数据案例揭晓,贵州从聚数到算数心里有数,天眼聚焦2023数博会",,2023-05-27 16:33:26
4906032926822223	,N2wWwsCLR,【#教外交官学贵阳话是什么体验# 】5月26日，2023中国国际大数据产业博览会在贵阳市开幕。#天眼聚焦2023数博会#戳视频，让我们一起跟着贵州国际传播中心记者毛豆，直击2023数博会开幕式现场。带大家沉浸式看新闻岛Big Data可爱的机器人墙、和百度AI主播“希加加”有个约会，探索数博“黑科技”，领略大数据应用的魅力。更有与法国驻成都总领事馆总领事的现场贵阳话教学，看外交官如何学会贵阳话。（贵州日报天眼新闻记者 李钰  高航） 贵州日报官微的微博视频,,,"https://f.video.weibocdn.com/o0/aeDVhmHQlx085LAkGFUs01041202i1FA0E010.mp4?label=mp4_720p&template=1280x720.25.0&ori=0&ps=1BThihd3VLAY5R&Expires=1687181951&ssig=tPaMNKwW18&KID=unistore,video",,2023-05-27,微博视频号,21,3,0,"教外交官学贵阳话是什么体验,天眼聚焦2023数博会",,2023-05-27 15:34:22
4906026045017030	,N2wLql39Q,【#2023中国大数据独角兽企业榜单# 】5月27日，由中国国际大数据产业博览会组委会主办、长城战略咨询承办的“2023中国大数据独角兽企业榜单发布”活动在贵阳国际生态会议中心举行。会上，长城战略咨询中级合伙人、企业咨询总监马宇文重磅发布了2023中国大数据独角兽及潜在独角兽企业榜单及《2023中国大数据（潜在）独角兽企业研究报告》，报告展示出中国大数据产业内新锐力量的创新成果，揭示出独角兽等新物种企业前沿发展趋势。（via.贵阳网）,,"https://wx2.sinaimg.cn/large/005DIjE0ly1hecyf1jifqj30xc62qqv5.jpg,https://wx3.sinaimg.cn/large/005DIjE0ly1hecyf4r3b9j30xc9ux1kz.jpg",,,2023-05-27,HUAWEI P40 Pro 5G,0,0,1,2023中国大数据独角兽企业榜单,,2023-05-27 15:07:01
