id,bid,正文,头条文章url,原始图片url,视频url,位置,日期,工具,点赞数,评论数,转发数,话题,@用户
4902728990463569	,N18ZB1WAV,【好浪漫！#萤火虫林间起舞似星河#】初夏时节，广东广州华南植物园，成群的萤火虫在茂密的树林中飞舞穿梭，如点点星光在夜空中闪烁，又仿若璀璨银河坠入林间，唯美梦幻！#夏天的浪漫是萤火虫给的#（人民日报）荔枝风景线的微博视频 ,,,"https://f.video.weibocdn.com/o0/2Yo276GIlx085wYcbXSM01041200h3Mu0E010.mp4?label=mp4_720p&template=1280x720.25.0&ori=0&ps=1CwnkDw1GXwCQx&Expires=1687149737&ssig=Wf52h13rQx&KID=unistore,video",,2023-05-18,微博视频号,1,0,0,"萤火虫林间起舞似星河,夏天的浪漫是萤火虫给的",,2023-05-18 12:45:42
4902728206386025	,N18YkqNip,【收藏！#三甲医院医生教你腰椎操#】久坐对腰不好，跟着浙大邵逸夫医院骨科医生一起跳健康腰椎操，一定要坚持练习~（人民网）人民网的微博视频 ,,,"https://f.video.weibocdn.com/o0/rA0myhS9lx085wRwG3Ac01041201OwtV0E010.mp4?label=mp4_720p&template=720x1280.24.0&ori=0&ps=1CwnkDw1GXwCQx&Expires=1687149737&ssig=urGDIDYtmc&KID=unistore,video",,2023-05-18,微博视频号,0,0,0,三甲医院医生教你腰椎操,,2023-05-18 12:42:35
4902727933498483	,N18XTeG79,【#北斗家族好事成双# 今天你“北斗”了吗？】#北斗是怎样改变我们生活的# 5月17日，北斗“家族”再添“新星”！今天，《2023中国卫星导航与位置服务产业发展白皮书》正式发布，北斗“家族”好事成双！白皮书显示，2022年我国卫星导航与位置服务产业总体产值达到5007亿元人民币，国内卫星导航定位终端产品总销量超3.76亿台。这么多用到北斗的终端产品在哪里呢？戳↓↓ #北斗为梦想导航#（央视网）央视网的微博视频,,,"https://locallimit.us.sinaimg.cn/o0/jToERF8clx085wY9Y7C801041202fMCz0E010.mp4?label=mp4_720p&template=1280x720.25.0&ori=0&ps=1BThihd3VLAY5R&Expires=1687149738&ssig=wP%2Fd%2BTaPNd&KID=unistore,video",,2023-05-18,微博视频号,0,0,0,"北斗家族好事成双,北斗是怎样改变我们生活的,北斗为梦想导航",,2023-05-18 12:41:30
4902703073331877	,N18jNdYLX,【29秒开始惊喜“展翅”！#原来星箭分离画面这么震撼#】5月17日，我国成功发射第五十六颗北斗导航卫星。“星箭分离！”看到这一幕，哪句诗词涌上心头？戳视频↓（人民日报）我们的太空的微博视频 ,,,"https://f.video.weibocdn.com/o0/8HwdqHInlx085vReHCLm01041200n8ls0E010.mp4?label=mp4_720p&template=1280x720.25.0&ori=0&ps=1CwnkDw1GXwCQx&Expires=1687149738&ssig=%2FKaaHxndor&KID=unistore,video",,2023-05-18,微博视频号,0,0,0,原来星箭分离画面这么震撼,,2023-05-18 11:02:43
4902702972145221	,N18jD904l,【#43年前的今天我们有了自己的洲际导弹#】1980年5月18日，我国第一枚洲际导弹“东风五号”在酒泉点火升空，经过半小时飞行，到达南太平洋预定海域。我国成为继美苏之后，第三个拥有远程洲际弹道导弹的国家。#珍贵影像回顾东风五号震撼历史#↓↓（人民日报）央视军事的微博视频 ,,,"https://f.video.weibocdn.com/o0/tB8r9Ttylx085vWrqpMQ01041200Kclb0E010.mp4?label=mp4_720p&template=1280x720.25.0&ori=0&ps=1CwnkDw1GXwCQx&Expires=1687149738&ssig=3onIL8MlvN&KID=unistore,video",,2023-05-18,微博视频号,0,0,0,"43年前的今天我们有了自己的洲际导弹,珍贵影像回顾东风五号震撼历史",,2023-05-18 11:02:19
4902702377865603	,N18iFx0cz,【#哪个词支撑你拼过整个高三#】今天，#距2023高考还有20天#。“拼搏”“奋斗”“冲刺”“坚持”……这些简短的词汇激励了你多少个奋斗的日夜？还有20天，考生们就要踏进战场了，今天的努力终会让闪耀的梦想成为自己最骄傲的功勋。转发，一起祝福2023高考生，胜利一定属于你们！（新华社） ,,"https://wx4.sinaimg.cn/large/0068yjmdgy1he2cobn3wdj30j60sr7dd.jpg,https://wx4.sinaimg.cn/large/0068yjmdgy1he2cofvo60j30j60sr0yz.jpg,https://wx2.sinaimg.cn/large/0068yjmdgy1he2coocfokj30j60srq9n.jpg,https://wx2.sinaimg.cn/large/0068yjmdgy1he2coqshnoj30j60srq9n.jpg,https://wx2.sinaimg.cn/large/0068yjmdgy1he2cotj7v2j30j60sr486.jpg,https://wx3.sinaimg.cn/large/0068yjmdgy1he2cow1n66j30j60sr486.jpg,https://wx1.sinaimg.cn/large/0068yjmdgy1he2coy8ubej30j60srwmf.jpg,https://wx2.sinaimg.cn/large/0068yjmdgy1he2cp0nn14j30j60sr44d.jpg,https://wx3.sinaimg.cn/large/0068yjmdgy1he2cp3eklgj30j60srqcb.jpg",,,2023-05-18,微博网页版,0,0,0,"哪个词支撑你拼过整个高三,距2023高考还有20天",,2023-05-18 10:59:57
4902701718834048	,N18hBB48E,【新华社权威快报丨#国家金融监督管理总局今日揭牌#】国家金融监督管理总局18日揭牌，我国新一轮金融监管领域机构改革迈出重要一步。组建国家金融监督管理总局，优化和调整金融监管领域的机构职责，对于加强和完善现代金融监管，解决金融领域长期存在的突出矛盾和问题具有十分重要的意义。 （新华社）,,https://wx2.sinaimg.cn/large/0068yjmdgy1he2cmgr4f9j30j60u9dm0.jpg,,,2023-05-18,微博网页版,0,0,0,国家金融监督管理总局今日揭牌,,2023-05-18 10:57:20
4902692733849936	,N1837g9xK,【一口吃下千年！那些#藏在雪糕里的国家宝藏#】近年来，各大博物馆纷纷推出文创雪糕，引来打卡热潮。中国国家博物馆的东汉击鼓说唱俑、甘肃省博物馆的铜奔马，还有#鸮卣大概是最萌的文物了吧#，这些元素都融入了雪糕↓↓国际博物馆日，一起认识你“吃过”的那些国家宝藏。（人民日报） ,,"https://wx4.sinaimg.cn/large/0068yjmdgy1he2bklo2hsj30j60smk1h.jpg,https://wx3.sinaimg.cn/large/0068yjmdgy1he2bkyid90j30j60smtig.jpg,https://wx1.sinaimg.cn/large/0068yjmdgy1he2bl0k6mxj30j60smk0x.jpg,https://wx3.sinaimg.cn/large/0068yjmdgy1he2bl307coj30j60smwob.jpg,https://wx1.sinaimg.cn/large/0068yjmdgy1he2bl5dwmaj30j60sm488.jpg,https://wx3.sinaimg.cn/large/0068yjmdgy1he2bl8sad5j30j60sm7dy.jpg,https://wx2.sinaimg.cn/large/0068yjmdgy1he2blb793zj30j60sm48l.jpg,https://wx3.sinaimg.cn/large/0068yjmdgy1he2bldb51wj30j60smdp9.jpg,https://wx2.sinaimg.cn/large/0068yjmdgy1he2blfcz43j30j60sm12e.jpg",,,2023-05-18,微博网页版,0,0,1,"藏在雪糕里的国家宝藏,鸮卣大概是最萌的文物了吧",,2023-05-18 10:21:38
4902691632057040	,N181l8D84,【直播！#博物馆里藏着穿越时空的浪漫#】今天是国际博物馆日。@央视新闻 带你去上海博物馆，看馆藏宋元古籍展，品味古籍之美；到辽宁参观世界音乐文化博物馆，感受旋律盛宴；去北京大钟寺古钟博物馆，寻觅古韵钟声；探鄂尔多斯青铜器博物馆，感受马背上的青铜世界。戳↓#一起逛博物馆#，来一场与时空的浪漫之约！（央视新闻）央视新闻的微博视频,,,"https://live.video.weibocdn.com/664a7b55-a705-440e-8885-68f52a94fe13_index.m3u8?ori=0&ps=1BThihd3VLAY5R&Expires=1687149738&ssig=4rRMKbwL5Q&KID=unistore,video",,2023-05-18,微博网页版,0,0,0,"博物馆里藏着穿越时空的浪漫,一起逛博物馆",央视新闻,2023-05-18 10:17:15
4902690884686054	,N1808jF3w,【#下个月你工资卡里或将多一笔钱#】伴随着夏日的到来，用人单位安排劳动者在35℃以上高温天气从事室外露天作业，以及不能采取有效措施将工作场所温度降低到33℃以下的，应当向劳动者发放高温津贴。#高温津贴属于工资还是福利#？防暑降温费和高温津贴有什么区别？详戳↓↓ （人民网） 下个月，你工资卡里或将多一笔钱！,,,,,2023-05-18,微博网页版,0,0,0,"下个月你工资卡里或将多一笔钱,高温津贴属于工资还是福利",,2023-05-18 10:14:17
4902690008861262	,N17YIBbdA,【#中国旅游日首支主题MV# 】在文化和旅游部市场管理司的指导下，由央视网联合腾讯文旅、腾讯新闻共同发起的中国旅游日「首支主题MV」——《走啊！去旅游！》正式上线！赶紧转发给你的旅游搭子，计划一场说走就走的旅行吧！#中国旅游日#（央视网）央视网的微博视频 ,,,"https://locallimit.us.sinaimg.cn/o0/GQ5kjmDBlx085wLEGVH201041201iMWW0E010.mp4?label=mp4_720p&template=1280x720.25.0&ori=0&ps=1CwnkDw1GXwCQx&Expires=1687149738&ssig=lPNCfLPomM&KID=unistore,video",,2023-05-18,微博视频号,0,0,0,"中国旅游日首支主题MV,中国旅游日",,2023-05-18 10:10:48
4902689786302863	,N17YmqrF5,【开辟绿色通道 “吃货们”能第一时间吃上新鲜的海南荔枝啦！】为减低荔枝因长途运输造成的损失，海口新海港、秀英港已开辟荔枝运输车辆绿色通道。同时，即日起，新海港还开设荔枝车专班，确保荔枝车能够快速出岛。在装载方面，荔枝车专班调用大型船舶进行装载，确保装载速度快，装载效率更高。海南海峡推荐配合“一站式支付”功能使用，司机“足不出车”就能在专属车道完成船票购买，大大提高了通行效率。（海南日报）,,https://wx3.sinaimg.cn/large/0068yjmdgy1he2b97yrvsj30j60asq45.jpg,,,2023-05-18,微博网页版,0,0,0,,,2023-05-18 10:09:55
4902681711743260	,N17Ll7jv6,【海口发布高温橙色预警信号】海口市气象台2023年05月18日09时30分继续发布高温橙色预警信号：受西南气流影响，我市大部分地区今天下午13时至17时最高气温将升至37℃以上，预计高温天气将持续至22日，请有关单位和人员做好防范工作。防御指南：1.有关部门和单位按照职责落实防暑降温保障措施；2.尽量避免在高温时段进行户外活动，高温条件下作业的人员应当缩短连续工作时间；3.对老、弱、病、幼人群提供防暑降温指导，并采取必要的防护措施；4.有关部门和单位应当注意防范因用电量过高，以及电线、变压器等电力负载过大而引发的火灾。,,https://wx3.sinaimg.cn/large/0068yjmdgy1he2abufvbuj306805adfy.jpg,,,2023-05-18,微博网页版,0,0,0,,,2023-05-18 09:37:50
4902535179011374	,N13WZBOgK,【堪比表情包！这些博物馆藏品有点“皮”】你印象中的文物什么样？深沉严肃，自带高冷气场？其实，它们也有千奇百怪的表情和呆萌可爱的一面。5月18日#2023国际博物馆日#，#用表情包的方式打开博物馆文物#！ 人民日报的微博视频 ,,,"https://f.video.weibocdn.com/o0/941Oh67hlx085w414zDa01041200QzQ60E010.mp4?label=mp4_720p&template=1280x720.25.0&ori=0&ps=1CwnkDw1GXwCQx&Expires=1687149739&ssig=I%2FeQYN9Sd1&KID=unistore,video",,2023-05-17,微博视频号,1,0,0,"2023国际博物馆日,用表情包的方式打开博物馆文物",,2023-05-17 23:55:34
4902535088050827	,N13WQxMo3,【海南省工伤医疗费用实现全省联网即时结算 附定点医疗机构名单→】5月17日，海南省社保中心最新汇总数据显示，目前全省共有48家定点医疗机构实现了工伤医疗费用省域联网即时结算，每个市县至少有1家定点医疗机构可以“一站式”联网结算，工伤职工看病就医更加便利。工伤职工只需凭个人身份证、社保卡（含电子社保卡）、医保电子凭证中的一种，即可在这些工伤保险定点医疗机构即时结算。（海南日报）海南省工伤医疗费用实现全省联网即时结算 附定点医疗机构名单→,,https://wx2.sinaimg.cn/large/0068yjmdgy1he1thmz5g3j30c80khtbd.jpg,,,2023-05-17,OPPO Reno7 Pro 5G,0,0,0,,,2023-05-17 23:55:12
4902421342194244	,N10Zo9cP2,【一些羡慕！#大熊猫萌兰边享受水雾边干饭#】近日，随着天气渐渐升温，北京动物园给大熊猫萌兰开启了喷淋降温模式。萌兰坐在铺凉席小秋千上一边享受水雾，一边吃竹笋。网友：“三太子”的精致生活让人羡慕！（人民日报）陕视新闻的微博视频 ,,,"https://f.video.weibocdn.com/o0/lCA3iFGDlx085vl2NDzy01041200f5q20E010.mp4?label=mp4_720p&template=720x1280.24.0&ori=0&ps=1CwnkDw1GXwCQx&Expires=1687149739&ssig=clFRv0NIWR&KID=unistore,video",,2023-05-17,微博视频号,0,0,0,大熊猫萌兰边享受水雾边干饭,,2023-05-17 16:23:13
4902398499753441	,N10oxEVjz,【#森林粮库让中国饭碗更丰盛#】#让中国饭碗更丰盛# 今年的中央一号文件提出，构建多元化食物供给体系。目前，我国森林覆盖率达24.02%，森林面积达2.31亿公顷，丰富的森林资源提供了各种各样的森林食品。森林作为“粮库”，是多元化食物供给体系的重要组成部分，为中国饭碗提供了更“丰盛”的食品↓↓（央视网）央视网的微博视频,,,"https://locallimit.us.sinaimg.cn/o0/0QfLP8tslx085vsgFmIU01041200QMda0E010.mp4?label=mp4_720p&template=1280x720.25.0&ori=0&ps=1BThihd3VLAY5R&Expires=1687149740&ssig=IHerZhq9qS&KID=unistore,video",,2023-05-17,微博视频号,0,0,0,"森林粮库让中国饭碗更丰盛,让中国饭碗更丰盛",,2023-05-17 14:52:27
4902395056753458	,N10iZskSK,【练起来！#三甲医院医生教你3分钟颈椎操#】每天早晚三分钟，跟着节奏练，缓解肩颈酸痛。简单有效，适合久坐、低头玩手机人群，快来试试吧↓↓ （新华日报）人民网的微博视频 ,,,"https://f.video.weibocdn.com/o0/fJ9q5fNflx085vcSk92g01041201HHq80E010.mp4?label=mp4_720p&template=720x1280.24.0&ori=0&ps=1CwnkDw1GXwCQx&Expires=1687149739&ssig=fBfOM9QVMh&KID=unistore,video",,2023-05-17,微博视频号,2,0,2,三甲医院医生教你3分钟颈椎操,,2023-05-17 14:38:46
4902383346519317	,N1006rlYh,【#海口发布高温橙色预警信号# 】海口市气象台2023年05月17日13时40分发布高温橙色预警信号：受西南气流影响，我市大部分地区今天下午13时至17时最高气温将升至37℃以上，预计高温天气将持续至22日，请有关单位和人员做好防范工作。防御指南：1.有关部门和单位按照职责落实防暑降温保障措施；2.尽量避免在高温时段进行户外活动，高温条件下作业的人员应当缩短连续工作时间；3.对老、弱、病、幼人群提供防暑降温指导，并采取必要的防护措施；4.有关部门和单位应当注意防范因用电量过高，以及电线、变压器等电力负载过大而引发的火灾。,,https://wx1.sinaimg.cn/large/0068yjmdgy1he1c1d57juj30m20v740k.jpg,,,2023-05-17,iPhone 8 Plus,0,0,0,海口发布高温橙色预警信号,,2023-05-17 13:52:14
4902372277486661	,N0ZIfvpCB,【祝贺！#第56颗北斗导航卫星成功发射#】2023年5月17日10时49分，我国在西昌卫星发射中心用长征三号乙运载火箭，成功发射第五十六颗北斗导航卫星。该卫星属地球静止轨道卫星，是我国北斗三号工程的首颗备份卫星。入轨并完成在轨测试后，将接入北斗卫星导航系统。此次发射是北斗三号工程高密度组网之后，时隔3年的首发任务。（人民网）中国航天科技集团的微博视频,,,"https://f.video.weibocdn.com/o0/bXyC5akRlx085vmpz1gY01041200ocks0E010.mp4?label=mp4_720p&template=720x1280.24.0&ori=0&ps=1BThihd3VLAY5R&Expires=1687149741&ssig=4Cp0ZMUbbH&KID=unistore,video",,2023-05-17,微博视频号,1,0,0,第56颗北斗导航卫星成功发射,,2023-05-17 13:08:15
4902372210644599	,N0ZI92HGL,#笑果在京所有演出活动无限期暂停#【#官方通报对笑果调查结果#】2023年5月15日，北京市文化市场综合执法总队接群众举报，决定对上海笑笙文化传媒有限公司依法立案调查。经查实，该公司及其演员李昊石肆意篡改演出申报内容，在5月13日下午、晚上连续两场“笑果脱口秀”演出中出现严重侮辱人民军队的情节，造成恶劣社会影响。#笑果被罚#该公司行为违反了《营业性演出管理条例》第二十五条、第二十六条规定。依据《营业性演出管理条例》第四十六条规定，北京市文化市场综合执法总队决定对该公司作出相应行政处罚：警告、没收违法所得1325381.6元、罚款13353816元。对涉案人员及其演出经纪机构和演出场所经营单位相关违规行为将进一步依法依规追究责任。北京市文化和旅游局决定无限期暂停涉事公司在京所有演出活动。人民军队是守卫国家安全、守护人民安宁的坚强卫士，我们绝不允许任何公司和个人在首都舞台肆意诋毁人民军队的光辉形象，绝不允许伤害广大人民群众对子弟兵的深厚感情，绝不允许把严肃题材娱乐化。我们将坚持强化监管、严格执法，坚决抵制只求“笑果”不计后果、只讲经济收益不讲社会责任的行为。希望广大文艺工作者遵守法律法规，端正创作思想，加强道德修养，自觉讲品味、讲格调、讲责任，为人民群众提供有营养的精神食粮。（文旅北京）,,https://wx2.sinaimg.cn/large/0068yjmdgy1he1as3teyij30j60ltgtq.jpg,,,2023-05-17,微博网页版,0,0,0,"笑果在京所有演出活动无限期暂停,官方通报对笑果调查结果,笑果被罚",,2023-05-17 13:07:59
4902367244061056	,N0ZA8h2sU,【#2000多个造谣传谣账号被关停或禁言#】#公安机关开展专项行动整治网络谣言# 记者从公安部了解到，公安部网安局4月中旬部署开展为期100天的网络谣言打击整治专项行动。全国公安机关依法打击一批恶意编造传播网络谣言的组织者、策划者和主要实施者，依法打击一批借热点事件造谣引流非法牟利的网络水军团伙，依法整治一批网络谣言问题突出的互联网企业，清理关停一批违法违规网络账号。截至目前，共清理网络谣言近7万余条，关停或禁言造谣传谣网络账号2000余个，侦办网络谣言案件300余起。（新华日报）央视网的微博视频,,,"https://locallimit.us.sinaimg.cn/o0/EfXFA8NOlx085vdzLOYo01041200tYZ20E010.mp4?label=mp4_720p&template=1280x720.25.0&ori=0&ps=1BThihd3VLAY5R&Expires=1687149741&ssig=thBmkzkpMR&KID=unistore,video",,2023-05-17,微博视频号,0,0,0,"2000多个造谣传谣账号被关停或禁言,公安机关开展专项行动整治网络谣言",,2023-05-17 12:48:15
4902365192786465	,N0ZwPbGSZ,【来收图了！#被这些博物馆藏品笑到#】当代#年轻人在逛一种很新的博物馆#。“听到大瓜一脸震惊”陶塑人头像、“困到流泪”人首彩绘陶塑、“委屈巴巴需要哄”俳优俑…文物是正经文物，“打开方式”就看你怎么看。明天，#2023国际博物馆日#，转存表情包，和可爱藏品一起快乐一下↓↓ （人民日报） ,,"https://wx1.sinaimg.cn/large/0068yjmdgy1he19ynv95nj30j60nzgrb.jpg,https://wx2.sinaimg.cn/large/0068yjmdgy1he19yqcr1dj30j60nzq8u.jpg,https://wx1.sinaimg.cn/large/0068yjmdgy1he19yseji8j30j60nz79u.jpg,https://wx1.sinaimg.cn/large/0068yjmdgy1he19yw04raj30j60nzn22.jpg,https://wx2.sinaimg.cn/large/0068yjmdgy1he19yy03txj30j60nzte5.jpg,https://wx3.sinaimg.cn/large/0068yjmdgy1he19yzzpvwj30j60nzn4h.jpg,https://wx4.sinaimg.cn/large/0068yjmdgy1he19z2pjb8j30j60nzn29.jpg,https://wx3.sinaimg.cn/large/0068yjmdgy1he19z4w0nij30j60nzwjz.jpg,https://wx4.sinaimg.cn/large/0068yjmdgy1he19z6lpbsj30j60nzdju.jpg",,,2023-05-17,微博网页版,1,0,0,"被这些博物馆藏品笑到,年轻人在逛一种很新的博物馆,2023国际博物馆日",,2023-05-17 12:40:06
4902363632505016	,N0ZujavFu,【壮观！#云海中的金山岭长城宛如飞龙#】近日，河北滦平，一场雨后，金山岭长城出现壮美的云海景观。蜿蜒的长城，在滚滚云海间，宛如一条破云而出的飞龙，迎着天际的旭日晨光，满身金鳞熠熠生辉。#云海和长城同框的震撼#↓↓（人民日报）人民日报的微博视频 ,,,"https://f.video.weibocdn.com/o0/VI0xdErklx085vgEsa4o01041200hJ8S0E010.mp4?label=mp4_720p&template=1280x720.25.0&ori=0&ps=1CwnkDw1GXwCQx&Expires=1687149741&ssig=fbe9bckZ4A&KID=unistore,video",,2023-05-17,微博视频号,0,0,0,"云海中的金山岭长城宛如飞龙,云海和长城同框的震撼",,2023-05-17 12:33:54
4902335476929151	,N0YKTt4Av,【收藏！#遇见更好自己的9个小细节#】记录美好、经常微笑、亲近自然、懂得分享……愿你怀揣热爱，奔山赴海，把每一天过得热气腾腾！加油！（央视新闻） ,,"https://wx3.sinaimg.cn/large/0068yjmdgy1he16jtwh9lj30j60j6tcz.jpg,https://wx4.sinaimg.cn/large/0068yjmdgy1he16jvqlidj30j60j6dk3.jpg,https://wx1.sinaimg.cn/large/0068yjmdgy1he16jy08z0j30j60j6djh.jpg,https://wx2.sinaimg.cn/large/0068yjmdgy1he16k0c6ytj30j60j6ae1.jpg,https://wx4.sinaimg.cn/large/0068yjmdgy1he16k22ee1j30j60j642h.jpg,https://wx1.sinaimg.cn/large/0068yjmdgy1he16k3wojwj30j60j6gph.jpg,https://wx2.sinaimg.cn/large/0068yjmdgy1he16k5zyhcj30j60j6789.jpg,https://wx2.sinaimg.cn/large/0068yjmdgy1he16k8rhvgj30j60j6n0s.jpg,https://wx1.sinaimg.cn/large/0068yjmdgy1he16kap5mxj30j60j6gpk.jpg",,,2023-05-17,微博网页版,0,0,0,遇见更好自己的9个小细节,,2023-05-17 10:42:01
4902334843062995	,N0YJScQP9,【又是荔枝飘香时！海南荔枝的这些小知识，你都知道吗？】↓↓ （海南日报） ,,https://wx1.sinaimg.cn/large/0068yjmdgy1he16hm3kc5j30j688ax6p.jpg,,,2023-05-17,微博网页版,1,0,0,,,2023-05-17 10:39:30
4902334452728313	,N0YJfbrL3,【#海南发现新记录物种# 能通过“晒太阳”养活自己的软体动物】#这种软体动物靠晒太阳养活自己#近日，研究人员公布了近三年来在海南省发现的2个新记录物种案例：白边侧足海天牛和绒毛海天牛，这是在中国大陆首次正式记录的，能依靠光合作用提供“养料”的软体动物。@小央视频 （新华日报）小央视频的微博视频,,,"https://f.video.weibocdn.com/o0/uWGHKp5Qlx085sB6c5WU01041200rCR70E010.mp4?label=mp4_720p&template=1280x720.25.0&ori=0&ps=1BThihd3VLAY5R&Expires=1687149742&ssig=aP5X9dQFnp&KID=unistore,video",,2023-05-17,微博视频号,1,0,2,"海南发现新记录物种,这种软体动物靠晒太阳养活自己",小央视频,2023-05-17 10:37:56
4902322059347460	,N0YpfDdHu,【玩手机时注意！#低头45°相当于脖子负重22公斤#】数据显示，我国颈椎病的发病率为15%左右，且发病有逐年增长、逐步年轻化趋势。专家提醒注意这些症状：①颈肩部疼痛，手和上肢麻木；②行走不稳，#脚底有踩棉花感要考虑颈椎病#；③容易摔倒、绊跤。周知！（央视） 人民日报的微博视频 ,,,"https://f.video.weibocdn.com/o0/Jokmz0p9lx085vbKnmco01041200BmS40E010.mp4?label=mp4_720p&template=1280x720.25.0&ori=0&ps=1CwnkDw1GXwCQx&Expires=1687149741&ssig=OmexlOgtaU&KID=unistore,video",,2023-05-17,微博视频号,0,0,0,"低头45°相当于脖子负重22公斤,脚底有踩棉花感要考虑颈椎病",,2023-05-17 09:48:42
4902321995649058	,N0Yp9nHzQ,【别大意！#年轻人也会患高血压#】一个多月前，河南洛阳一初中生经常感到头晕，测量后发现其血压值较高。医生介绍：目前，我国高血压发病人群低龄化趋势明显。除遗传因素外，长期过量饮酒吸烟、精神紧张、缺乏运动、高盐饮食等，都是导致此现象的主要原因。#部分早期高血压患者没有任何症状#，或者症状不明显，需提高警惕。如何管好自己的血压？看↓关乎健康，转需！ 央视新闻的微博视频,,,"https://f.video.weibocdn.com/o0/cYhTWXAzlx085vaNCj4s01041201Fntj0E010.mp4?label=mp4_720p&template=1280x720.25.0&ori=0&ps=1BThihd3VLAY5R&Expires=1687149742&ssig=J2R0qKy0vv&KID=unistore,video",,2023-05-17,微博视频号,0,0,0,"年轻人也会患高血压,部分早期高血压患者没有任何症状",,2023-05-17 09:48:27
4902321882927589	,N0YoYchBb,【乘机请提前2-3小时到达！海口美兰国际机场提高安全检查等级】据“海口美兰国际机场发布”微信公众号消息，为进一步加强安保防范力度，保障旅客出行安全，近期海口美兰国际机场将提升安检等级。同时特别提醒各位旅客，请不要携带违禁品，请旅客至少在航班起飞前2-3小时抵达机场办理乘机手续、接受安全检查，如有提取免税物品的旅客，请预留出取货时间，以免耽误行程。详戳→网页链接（海南日报）,,https://wx4.sinaimg.cn/large/0068yjmdgy1he1504ssimj30u00mgwlg.jpg,,,2023-05-17,OPPO Reno7 Pro 5G,0,1,0,,,2023-05-17 09:48:00
4902185655338691	,N0URfmoPV,【#5·19中国旅游日# 丨#全国五大主题倒计时城市海口分会场活动正式启动#】5月16日，“5·19中国旅游日”全国五大主题倒计时城市海口分会场启动仪式在海口世纪公园开启。活动以“绿色旅游”为主题，通过举办“这一口，很海口”城市推介会、I LOVE海口城市主题市集、I LOVE 海口城市音乐会等精彩活动展现绿色海口文明之城、活力之城、浪漫之城、时尚之城的新风采。#“绿色旅游”主题海口分会场# 网页链接,,"https://wx1.sinaimg.cn/large/0068yjmdgy1he0oli3otij30zk0j6ad6.jpg,https://wx3.sinaimg.cn/large/0068yjmdgy1he0nyeihg0j30u00k24px.jpg,https://wx3.sinaimg.cn/large/0068yjmdgy1he0o06hyanj30zk0notgt.jpg,https://wx1.sinaimg.cn/large/0068yjmdgy1he0om7hiljj30u00k1qu2.jpg,https://wx2.sinaimg.cn/large/0068yjmdgy1he0onw2oq4j30u00k0e01.jpg,https://wx2.sinaimg.cn/large/0068yjmdgy1he0onzu0iij30u00k0jth.jpg",,,2023-05-17,微博网页版,0,0,0,"5·19中国旅游日,全国五大主题倒计时城市海口分会场活动正式启动,“绿色旅游”主题海口分会场",,2023-05-17 00:46:41
