id,bid,正文,头条文章url,原始图片url,视频url,位置,日期,工具,点赞数,评论数,转发数,话题,@用户
4910507414263567	,N4plrhT9d,【#金毛冲进考场被民警无情请出#】6月7日，安徽舒城，一只小金毛随人群冲入考场，被考点的执勤民警“无情请出了大门”。网友：忘带双证了？（人民网）人民网的微博视频 ,,,"https://f.video.weibocdn.com/o0/oaiWzNaWlx0864yemhsc0104120077s40E010.mp4?label=mp4_720p&template=720x1280.24.0&ori=0&ps=1CwnkDw1GXwCQx&Expires=1687149580&ssig=itjdTB%2FL2u&KID=unistore,video",,2023-06-08,微博视频号,0,0,0,金毛冲进考场被民警无情请出,,2023-06-08 23:54:23
4910507280566345	,N4ple2nkB,【今年前5个月海南货物贸易进出口超960亿元】6月8日，记者从海口海关获悉，据统计，今年前5个月，海南货物贸易进出口961.5亿元，较去年同期（下同）增长28.6%。其中，出口294.5亿元，增长50.7%；进口667亿元，增长20.8%。（海南日报） ,,https://wx2.sinaimg.cn/large/0068yjmdgy1her92zx5evj30pz0aztbe.jpg,,,2023-06-08,微博网页版,0,0,0,,,2023-06-08 23:53:51
4910360148315868	,N4lvUyTkU,"【海口发布雷电黄色预警信号】海口市气象台2023年06月08日13时57分发布雷电黄色预警信号：预计，受对流云团影响，我市14-20时可能发生雷电活动，可能会出现雷电灾害事故，建议有关单位和人员做好防范工作。防御指南：1.政府及相关部门按照职责做好防雷防风工作；2.密切关注天气，尽量避免户外活动；3.把门窗、围板、棚架、临时搭建物等易被风吹动的搭建物固紧, 人员应当尽快离开临时搭建物，妥善安置易受雷雨大风影响的室外物品。 网页链接",,https://wx4.sinaimg.cn/large/0068yjmdgy1heqs6oq51uj306805aaa5.jpg,,,2023-06-08,OPPO Reno7 Pro 5G,0,0,0,,,2023-06-08 14:09:12
4910302238345658	,N4k0vz15o,【#40秒延时记录向日葵绽放#】摄影师通过延时记录下葵花绽放的瞬间。花苞向阳而生，金黄的花瓣在镜头下渐次绽放，十分明媚。祝福高考生，金榜题名，一举夺魁！（人民日报）荔枝风景线的微博视频 ,,,"https://f.video.weibocdn.com/o0/MzQdmoRWlx0862Rtt4BO01041200dVYW0E010.mp4?label=mp4_720p&template=1280x720.25.0&ori=0&ps=1CwnkDw1GXwCQx&Expires=1687149591&ssig=Mt8yu9VB3T&KID=unistore,video",,2023-06-08,微博视频号,0,0,0,40秒延时记录向日葵绽放,,2023-06-08 10:19:05
4910302120645141	,N4k0k2HPv,【热泪盈眶！#女高毕业生围抱张桂梅的画面看哭了#】#孩子们围抱张桂梅时喊抱轻一点# 7日晚，华坪女高的高三毕业生结束晚自习回到宿舍，她们把物品放下后突然就冲了出来，紧紧抱着张老师。有女生怕张老师身体承受不住，提醒同学们“抱轻一点”。8日，当地高考将会结束，她们也将离校，她们或许知道，这可能是最后一次能再抱抱张老师了。（新华社）新华社的微博视频,,,"https://f.video.weibocdn.com/o0/Y04bkWQHlx0864b4FTeg01041200IrqF0E010.mp4?label=mp4_720p&template=1280x720.25.0&ori=0&ps=1BThihd3VLAY5R&Expires=1687149591&ssig=a6pVMr2rTg&KID=unistore,video",,2023-06-08,微博视频号,0,0,0,"女高毕业生围抱张桂梅的画面看哭了,孩子们围抱张桂梅时喊抱轻一点",,2023-06-08 10:18:37
4910301798203973	,N4jZNyqe9,【海口全城，认真“作答”】6月7日17:00，伴随着铃声响起，2023高考首日平稳结束。高考，从来不是一个人的“战斗”，海口整座城市都在“认真作答”！和小布一起去看看吧→海口全城，认真“答题” ,,"https://wx2.sinaimg.cn/large/0068yjmdgy1heqlh2dlyoj30ov0hawqt.jpg,https://wx2.sinaimg.cn/large/0068yjmdgy1heqlh2riplj30q80er16r.jpg,https://wx4.sinaimg.cn/large/0068yjmdgy1heqlh30qytj30u00mitcn.jpg,https://wx1.sinaimg.cn/large/0068yjmdgy1heqlh20gxcj30u00migs6.jpg,https://wx4.sinaimg.cn/large/0068yjmdgy1heqlh0qze3j30u00mi77h.jpg,https://wx2.sinaimg.cn/large/0068yjmdgy1heqlh1bnsvj30m40etnca.jpg,https://wx2.sinaimg.cn/large/0068yjmdgy1heqlh1jnw4j30u00mi424.jpg,https://wx3.sinaimg.cn/large/0068yjmdgy1heqlh1sgscj30u00k0wi4.jpg,https://wx4.sinaimg.cn/large/0068yjmdgy1heqlh0yrwhj30u00mi44a.jpg",,,2023-06-08,微博网页版,1,0,0,,,2023-06-08 10:17:20
4910286206668515	,N4jAErYMH,【#12名盲人考生用盲文卷高考#】今年，来自11个省的12名盲人考生参加高考，教育部教育考试院为他们专门命制了统考盲文卷。此外，各地还为1万余名残障考生提供了设置“爱心通道”、延长考试时间、使用大字号试卷等合理便利，为他们顺利完成高考保驾护航↓↓网友：#不落下任何一位追梦的考生#，加油，#2023年高考必胜#！（央视新闻）央视新闻的微博视频,,,"https://f.video.weibocdn.com/o0/QGMIMwjzlx0863pX1lxC01041200emm90E010.mp4?label=mp4_720p&template=1280x720.25.0&ori=0&ps=1BThihd3VLAY5R&Expires=1687149591&ssig=%2Bxl2ICqpKg&KID=unistore,video",,2023-06-08,微博视频号,1,0,0,"12名盲人考生用盲文卷高考,不落下任何一位追梦的考生,2023年高考必胜",,2023-06-08 09:15:23
4910285997739307	,N4jAjwtlx,【提供岗位逾600个！6月8日海南举办一场公共招聘会】6月8日9时至12时，海南省公共招聘会将在海口举办，截至6月7日18时，已有47家用人单位提交报名信息，累计提供岗位612个。据了解，此次招聘会的用人单位涉及各领域，岗位丰富多样。其中，相关岗位包括营销策划总监、董事长助理、总经理助理、总监理工程师、土建监理工程师、资产评估师、前端开发工程师、JAVA后端开发工程师等。此次招聘会地点，位于海口市美兰区和邦路3号的海南省人力资源开发局（省就业局）一楼公共招聘大厅。部分岗位预览↓↓（海南日报）,,https://wx4.sinaimg.cn/large/0068yjmdgy1heqjo1veo8j30a00k275t.jpg,,,2023-06-08,微博网页版,0,0,0,,,2023-06-08 09:14:33
4910285795626343	,N4jzZnBFt,【海南将组团到省内和黔甘鄂多所职业技工院校引才】将于今年6月至7月举办的2023年海南省招工留才活动，将组团到省内和黔甘鄂多所职业技工院校引才。据了解，在2023年海南省招工留才活动中，将为技能型人才提供宽广发展平台。其中，在省内将于6月27日、7月2日，分别走进海南省三亚技师学院、海南省技师学院老城校区举办招聘专场。在省外，海南将于6月14日至16日，在贵州省的黔南民族师范学院、贵州机电职业技术学院等举办招聘专场；海南将于6月中下旬，在甘肃省的兰州科技职业学院、兰州职业技术学院等院校举办专场招聘会，在湖北省的武汉职业技术学院、湖北交通职业技术学院等院校举办专场招聘会。（海南日报）,,https://wx2.sinaimg.cn/large/0068yjmdgy1heqjn94trbj30pz0aztbe.jpg,,,2023-06-08,微博网页版,0,0,0,,,2023-06-08 09:13:45
4910285623656999	,N4jzIfllR,【海口天气】海口市气象台2023年6月8日8时发布未来3天天气预报：今天白天到夜间，多云间阴天有雷阵雨，市区气温25-33℃，乡镇气温25-32℃，南到西南风3-4级，近海海面5级，雷雨时阵风7-8级；9日（星期五），多云间阴天有雷阵雨，局地中到大雨，气温25-32℃；10日（星期六），多云有雷阵雨，局地中雨，气温26-31℃。,,https://wx1.sinaimg.cn/large/0068yjmdgy1heqjmj4lr6j30px0b3ad1.jpg,,,2023-06-08,微博网页版,0,0,0,,,2023-06-08 09:13:04
4910022440781611	,N4cJe3hkD,【交警引导货车绕行 保障考生“安静”应考】6月7日下午，在海口海港学校考点周边，执勤交警在滨海大道和海港路交叉口引导货车绕行。现场设置了禁止货车通行的警示标志，并安排警力现场引导，保障送考车辆及时送考。据悉，该考点安排了6名警力轮流引导货车绕行，在明日英语听力考试期间将全员同时上岗，确保高考期间海口考生能及时、安全奔赴考场，为考生提供安静的考场环境。（海口日报）#直击海口2023年高考# 海口日报的微博视频,,,"https://f.video.weibocdn.com/u0/tGGyRykwgx08637AUwVG01041200igkc0E010.mp4?label=mp4_720p&template=1280x720.25.0&ori=0&ps=1BThihd3VLAY5R&Expires=1687149592&ssig=OBEsGjgVv9&KID=unistore,video",,2023-06-07,微博视频号,0,0,0,直击海口2023年高考,,2023-06-07 15:47:16
4910021207131036	,N4cHetV6I,【“985的家长都上线！” #交警高情商维持考场秩序#】#加油高考生# 6月7日，四川绵阳一高考考点外，家长们正情绪高昂地聚在校门口。为维护道路秩序、缓和现场紧张情绪，执勤交警机智喊话：985的家长们，请站到线上去，都上线！网友：这谁能扛得住啊，乖乖上线~@绵阳交警一大队 （人民网）人民网的微博视频,,,"https://f.video.weibocdn.com/o0/RRW3FGrQlx0862Wc0u52010412009Dzz0E010.mp4?label=mp4_720p&template=1280x720.25.0&ori=0&ps=1BThihd3VLAY5R&Expires=1687149593&ssig=IAauIUylX7&KID=unistore,video",,2023-06-07,微博视频号,0,1,1,"交警高情商维持考场秩序,加油高考生",绵阳交警一大队,2023-06-07 15:42:22
4910020175855819	,N4cFzozmH,【#螺蛳粉生产线揭秘# 直播一起看！】软韧爽口的米粉，配上酸笋、花生、腐竹、酸豆角，再浇上熬制的螺蛳汤，一碗酸辣鲜香的螺蛳粉出餐了。#你喜欢吃螺蛳粉吗#？你知道袋装螺蛳粉是怎么生产出来的吗？螺蛳又是如何养殖的？@央视新闻 带你走进广西柳州螺蛳粉产业园，了解“小米粉”的“大产业”！（央视新闻）央视新闻的微博直播,,,,,2023-06-07,微博网页版,1,0,0,"螺蛳粉生产线揭秘,你喜欢吃螺蛳粉吗",央视新闻,2023-06-07 15:38:15
4910019302655835	,N4cEab8U3,【海南发布琼州海峡雷雨大风黄色预警信号】海南省气象台2023年06月07日15时28分继续发布海上雷雨大风黄色预警信号：琼州海峡海面7日15时35分至8日9时可能出现雷雨大风天气，风力达7～9级并伴有强雷电，建议有关单位和人员做好防范工作。  网页链接 ,,https://wx2.sinaimg.cn/large/0068yjmdgy1hepp1b3powj306805aweo.jpg,,,2023-06-07,OPPO Reno7 Pro 5G,0,0,1,,,2023-06-07 15:34:48
4910019097135448	,N4cDPtWfS,#加油高考生#【#国宝超萌高考应援#】#高考#语文结束了，无论发挥如何，都暂且放下，继续为下午的数学全力以赴。祝各位考生勇攀高峰，好成绩稳稳到手！@iPanda熊猫频道 （人民网）iPanda熊猫频道的微博视频 ,,,"https://f.video.weibocdn.com/o0/uQWfzY3blx0861B8X6xa01041200z7EI0E010.mp4?label=mp4_720p&template=1280x720.25.0&ori=0&ps=1CwnkDw1GXwCQx&Expires=1687149593&ssig=icTw0KjJgQ&KID=unistore,video",,2023-06-07,微博视频号,0,0,0,"加油高考生,国宝超萌高考应援,高考",iPanda熊猫频道,2023-06-07 15:33:59
4910018916257581	,N4cDxqfSJ,【#看了这篇你就是高考辟谣大王# 】#与高考有关的十二个谣言# 6月7日，高考正式开考。考生与家人打起精神全力以赴的同时，也要小心有人趁乱“浑水摸鱼”。我们搜集整理了近年来高考期间常见的一些谣言、骗术，建议熟读并背诵全文，谨防上当受骗！#今天把最好的祝福送给高考生# （央视网）看了这篇，你就是高考辟谣大王！,,,,,2023-06-07,微博网页版,0,0,0,"看了这篇你就是高考辟谣大王,与高考有关的十二个谣言,今天把最好的祝福送给高考生",,2023-06-07 15:33:16
4910007462922407	,N4cl4cgfB,【#全国各地高考作文汇总# 持续更新！转存！】#各地高考作文你擅长哪一篇#？看↓↓考生们加油！#高考作文#（央视新闻）2023年全国各地高考作文汇总 ,,,,,2023-06-07,OPPO Reno7 Pro 5G,0,0,0,"全国各地高考作文汇总,各地高考作文你擅长哪一篇,高考作文",,2023-06-07 14:47:45
4910007101949843	,N4cku8bf5,【#是一站也是一战#，祝福所有高考生！】#鲤鱼门地铁站隐藏了高考祝福彩蛋#今天，1291万考生奔赴高考考场。  “在这个炽热的夏天，我们绝不空手而归！”我们把对高考生的祝福，写到了深圳“鲤鱼门”地铁站内，愿踏上考场的学子们鱼跃龙门、梦想成真！ 人民日报的微博视频 ,,,"https://f.video.weibocdn.com/o0/GusCtrcalx0862PMN7f201041201dUij0E010.mp4?label=mp4_720p&template=1280x720.25.0&ori=0&ps=1CwnkDw1GXwCQx&Expires=1687149593&ssig=Vf2lgt8nF2&KID=unistore,video",,2023-06-07,微博视频号,0,0,0,"是一站也是一战,鲤鱼门地铁站隐藏了高考祝福彩蛋",,2023-06-07 14:46:19
4909930677014159	,N4aldtqHB,【海南省第一生态环境保护督察组进驻海口市督察公告】为深入学习贯彻党的二十大精神和习近平生态文明思想，经省委、省政府批准，海南省第一生态环境保护督察组进驻海口市开展督察。督察进驻期间（2023年6月7日－6月21日），设立专门值班电话：0898-36380029，专门邮政信箱：海南省海口市A131号邮政信箱；邮编：570312。督察组受理举报电话时间为每天08:00～12:00、14:30～18:00。根据省委、省政府要求和督察组职责，督察组主要受理海口市生态环境保护方面的来信来电举报。其他不属于受理范围的信访问题，将按规定交由被督察地方处理。海南省第一生态环境保护督察组进驻海口市督察公告,,https://wx1.sinaimg.cn/large/0068yjmdgy1hepeupi2ftj30p00anaa7.jpg,,,2023-06-07,微博网页版,5,1,1,,,2023-06-07 09:42:38
4909926231575809	,N4ae36BWh,【高考即将开始！揭秘#高考试卷从命题到押运保管全流程#】“神秘”的命题人、连垃圾都被严控的印刷单位、实时监控的运输过程、与试卷“同吃同住”的“守卷人”……#一张高考试卷是怎样产生的#？戳文章了解↓↓↓ （人民日报） 武装押运、专人看守…揭秘高考试卷的非凡“旅程” ,,,,,2023-06-07,微博网页版,0,0,0,"高考试卷从命题到押运保管全流程,一张高考试卷是怎样产生的",,2023-06-07 09:24:58
4909925936927364	,N4adzt47G,【2023高考语文考试开始】6月7日上午9时，语文科目考试正式开始。在海师附中考点外，陪考家长陆续减少，环卫工人正在清扫考点垃圾。据悉，开考15分钟后，迟到考生将禁止进入考点。（海口日报） ,,https://wx2.sinaimg.cn/large/0068yjmdgy1hepebecsptj30j60eetdb.jpg,,,2023-06-07,微博网页版,0,0,0,,,2023-06-07 09:23:48
4909925589847456	,N4ad0FjLW,【海口天气】海口市气象台2023年6月7日8时发布未来3天天气预报：今天白天到夜间，阴天间多云有雷阵雨，市区气温25-32℃，乡镇气温25-31℃，南到西南风3-4级，近海海面5级，雷雨时阵风7-8级；8日（星期四），多云间阴天有雷阵雨，气温25-32℃；9日（星期五），多云间阴天有雷阵雨，气温25-32℃。 ,,https://wx3.sinaimg.cn/large/0068yjmdgy1hepe9ytwyqj30px0b3ad1.jpg,,,2023-06-07,微博网页版,0,0,1,,,2023-06-07 09:22:25
4909780151570558	,N46qr6AzA,【太励志！#曾被当做废品的国宝送出高考祝福#】#国宝重器何尊自述开挂经历#：1963年我被宝鸡的农民大哥带回家，两年后又被他送进废品回收站，后来凭借精美的饕餮纹成功进入宝鸡市博物馆，那时候我叫“兽面纹尊”；马承源先生发现12行122字铭文“宅兹中国”，从此“何尊”天下知。沉睡地下三千年，我用实力决定了自己的价值。明天是高考第一天，希望你的人生也可以像我一样开挂！ 人民日报的微博视频,,,"https://f.video.weibocdn.com/o0/qV3ySpq0lx0861TyYUmk01041200zRFe0E010.mp4?label=mp4_720p&template=1280x720.25.0&ori=0&ps=1BThihd3VLAY5R&Expires=1687149594&ssig=L0PRZWpBRN&KID=unistore,video",,2023-06-06,微博视频号,0,0,0,"曾被当做废品的国宝送出高考祝福,国宝重器何尊自述开挂经历",,2023-06-06 23:44:30
4909777178068929	,N46lDxR61,【海南高招志愿6月27日起填报】海南省教育厅近日印发《2023年海南省普通高校招生实施办法》，明确今年高考网上志愿填报工作将于6月27日启动，录取工作共分3个批次进行，从7月9日开始至8月15日结束。（海南日报）详戳→网页链接 ,,https://wx1.sinaimg.cn/large/0068yjmdgy1heox8cxqb4j30or0ajt9a.jpg,,,2023-06-06,OPPO Reno7 Pro 5G,1,0,0,,,2023-06-06 23:32:41
4909776980935834	,N46lk3Vs6,"【海口发布雷电黄色预警信号】海口市气象台2023年06月06日21时58分继续发布雷电黄色预警信号：对流云团正自南向北移动，我市6小时内可能发生雷电活动，可能会出现雷电灾害事故，建议有关单位和人员做好防范工作。防御指南：1.政府及相关部门按照职责做好防雷防风工作；2.密切关注天气，尽量避免户外活动；3.把门窗、围板、棚架、临时搭建物等易被风吹动的搭建物固紧, 人员应当尽快离开临时搭建物，妥善安置易受雷雨大风影响的室外物品。 网页链接",,https://wx3.sinaimg.cn/large/0068yjmdgy1heox7jiuxej306805aaa5.jpg,,,2023-06-06,OPPO Reno7 Pro 5G,0,0,0,,,2023-06-06 23:31:54
4909754130632638	,N45Kt2EzQ,【海口发布雷雨大风黄色预警信号】海口市气象台2023年06月06日21时55分继续发布雷雨大风黄色预警信号：受对流云团影响，我市6小时内可能出现雷雨大风天气，风力达7～9级并伴有强雷电和局地短时强降水，建议有关单位和人员做好防范工作。防御指南：1.政府及相关部门按照职责做好防风防雷工作；2.人员应当留在房屋抗风能力较好的室内，并关好门窗；3.户外人员应当躲入有防雷设施的建筑物或者汽车内；不要在树下、电杆下、塔吊下避雨；在空旷场地不要打伞，不要把农具等扛在肩上；4.切断危险电源，妥善安置易受大风影响的室外物品，遮盖建筑物资；5.机场、高速公路、水上交通等单位应当采取保障交通安全的措施；6.相关水域水上作业和过往船舶回港避风，加固港口设施。,,https://wx2.sinaimg.cn/large/0068yjmdgy1heoul2479sj306805aweo.jpg,,,2023-06-06,微博网页版,0,0,0,,,2023-06-06 22:01:06
4909695846584456	,N44esrCUU,【#给1291万高考生的暖心手绘#：愿属于你的那朵花如愿绽放】你是不是也曾怀疑：自己的那颗种子会不会开花？经历过狂风暴雨，它在小心翼翼地长大。#明天高考#，请收拾好心情，等待和梦想见面吧！ （人民日报） ,,https://wx4.sinaimg.cn/large/0068yjmdgy1heonw3eqeyj30qo4gce6n.jpg,,,2023-06-06,OPPO Reno7 Pro 5G,0,0,0,"给1291万高考生的暖心手绘,明天高考",,2023-06-06 18:09:30
4909674547908718	,N43G6xbpY,【#高考带手机进场用不用都算作弊# 】#千万别忘了带准考证# 高考在即，教育部发布了2023年高考十问十答。在规划赴考行程时，教育部提醒要留足进入考点考场身份验证和安检的时间；出现紧急交通状况时可就近向交警寻求帮助。在衣着方面，建议不佩戴含有金属成分的手镯、项链、发夹等佩饰物品。在个人健康防护方面，考前尽量减少聚集和流动，不去人员密集场所；对发热或者突发疾病等，考生不必担心恐慌，各地考点都制定了相应的预案。赴考前，记得随身携带好《准考证》和省级招生考试机构规定的有效身份证件等必要入场证件，还要注意检查是否带齐省级招生考试机构规定的考试用品。自行打印《准考证》的考生，应检查是否有《准考证》内容以外的字迹。其他注意事项↓↓ （央视网）央视网的微博视频,,,"https://locallimit.us.sinaimg.cn/o0/mugKnv5slx0861v4lXAY01041200HksF0E010.mp4?label=mp4_720p&template=1280x720.25.0&ori=0&ps=1BThihd3VLAY5R&Expires=1687149595&ssig=F0zIZoqeU2&KID=unistore,video",,2023-06-06,微博视频号,0,0,1,"高考带手机进场用不用都算作弊,千万别忘了带准考证",,2023-06-06 16:44:52
4909674467691849	,N43FYwh05,【#海狮被塑料缠住海洋保护队追着解救#】#他们已经救了3200多只海狮# 纳米比亚的沿海地区生存着大约150万头海狮。记者了解到，当地渔民为了捕获更多鱼，通常会使用比较强韧的塑料制成的鱼线。这些鱼线一旦缠绕到海狮身上就会随着海狮的成长越缠越紧，进而威胁它们的生命。纳米比亚海洋保护队每周都会去海边，帮助海狮取下身上的绳子等异物，目前已经累计解救了超过3200只海狮。（央视网）央视网的微博视频,,,"https://locallimit.us.sinaimg.cn/o0/Q8uDQBlnlx0861ANoVTy01041200VuFq0E010.mp4?label=mp4_720p&template=1280x720.25.0&ori=0&ps=1BThihd3VLAY5R&Expires=1687149595&ssig=iRceuqeP4N&KID=unistore,video",,2023-06-06,微博视频号,0,0,1,"海狮被塑料缠住海洋保护队追着解救,他们已经救了3200多只海狮",,2023-06-06 16:44:33
4909674048262229	,N43FiyFnL,【上新了！#海南警方反酒驾广告太魔性#】专为各路酒驾醉驾司机配置的超敏感装置，百分百受用司机认同，一旦飙红嚣叫，重塑驾本、逆龄重考不再是梦……戳视频↓↓@海南警方 推出#警用酒精测试小飞棍#性能介绍一则。再次提醒：开车不喝酒，喝酒不开车！（人民网）海南警方的微博视频 ,,,"https://f.video.weibocdn.com/u0/nbqDc36lgx0861pBpako01041200mu9P0E010.mp4?label=mp4_720p&template=1280x720.25.0&ori=0&ps=1CwnkDw1GXwCQx&Expires=1687149594&ssig=yRCZIS71Ye&KID=unistore,video",,2023-06-06,微博视频号,0,0,0,"海南警方反酒驾广告太魔性,警用酒精测试小飞棍",海南警方,2023-06-06 16:42:53
4909673914304091	,N43F5i3GP,【#张桂梅高考时紧张到忘了名字#】#张桂梅回忆当年高考趣事# 2023年高考即将来临，张桂梅回忆起自己当年参加高考的趣事。年轻的她进入高考考场是不是也会紧张？又为何让整个考场哄堂大笑？哪一道题目答错了，曾让她痛失2分？戳视频↓↓听张老师讲她当年高考趣事！#张桂梅寄语2023高考生#（新华社） 新华社的微博视频,,,"https://f.video.weibocdn.com/o0/9d18Ac3Rlx0861BsU5wA01041200FpMz0E010.mp4?label=mp4_720p&template=1280x720.25.0&ori=0&ps=1BThihd3VLAY5R&Expires=1687149595&ssig=QNA3KV3hWX&KID=unistore,video",,2023-06-06,微博视频号,2,0,0,"张桂梅高考时紧张到忘了名字,张桂梅回忆当年高考趣事,张桂梅寄语2023高考生",,2023-06-06 16:42:21
4909642482454895	,N42QoaiD5,人用尽酷刑，鲜血流在衣服上，结成血痂，他始终没有泄露任何机密。“让我们的子孙后代，享受前人披荆斩棘的幸福吧。”1928年6月6日，陈乔年留下这句话后英勇就义，年仅26岁。致敬先烈！#95年前的今天陈乔年牺牲#（央视新闻）央视新闻的微博视频 ,,,"https://f.video.weibocdn.com/o0/5Tu5DOMnlx0861sZjlji01041200Dyfq0E010.mp4?label=mp4_ld&template=640x360.25.0&ori=0&ps=1CwnkDw1GXwCQx&Expires=1687149602&ssig=QdWY3eMKB1&KID=unistore,video",,2023-06-06,微博视频号,0,0,0,95年前的今天陈乔年牺牲,,2023-06-06 14:37:27
4909642293972827	,N42Q5gFvR,【202020！#用电子产品要记住的护眼口诀#】#关灯玩手机多伤眼#？关灯时，格外明亮的手机对眼睛是一个强刺激，不知不觉间会造成视疲劳，严重更会导致青光眼！如何护眼？详戳了解↓↓（人民日报）人民日报的微博视频 ,,,"https://f.video.weibocdn.com/o0/XbXQj6bDlx0861oARpFe01041200gmAQ0E010.mp4?label=mp4_720p&template=1280x720.25.0&ori=0&ps=1CwnkDw1GXwCQx&Expires=1687149602&ssig=T1Fb9DqFsw&KID=unistore,video",,2023-06-06,微博视频号,0,0,0,"用电子产品要记住的护眼口诀,关灯玩手机多伤眼",,2023-06-06 14:36:42
4909642226075938	,N42PYpuD0,【致考生：#祝考生们大胜归来#！】2023年全国高考明日开启，十年一搏六月梦，赢得寒窗锦绣程。全力拼搏过的你，定将金榜题名，大胜归来！#用电影预告片的方式打开高考#↓↓ 加油，少年！#明天高考#（人民日报）人民日报的微博视频 ,,,"https://f.video.weibocdn.com/o0/ZZ9cgXNqlx0861lDjnBS01041200DvGm0E010.mp4?label=mp4_720p&template=1280x720.25.0&ori=0&ps=1CwnkDw1GXwCQx&Expires=1687149602&ssig=DUkJ%2Bld9%2Bv&KID=unistore,video",,2023-06-06,微博视频号,0,0,0,"祝考生们大胜归来,用电影预告片的方式打开高考,明天高考",,2023-06-06 14:36:26
4909642142975460	,N42PQcu3i,【祝贺！#我国首艘国产大邮轮出坞#】6月6日，我国首艘国产大型邮轮成功出坞。这艘邮轮总吨13.55万吨，24层楼高，拥有2826间舱室，可容纳6500多人。因设计建造难度极高，被誉为造船工业“皇冠上的明珠”。根据计划，将于7月和8月份进行二次试航，并于11月份第六届中国国际进口博览会期间举行命名交付仪式。（新华社、CGTN记者团）,,"https://wx2.sinaimg.cn/large/0068yjmdgy1heohpvhuszj30j60e23zr.jpg,https://wx1.sinaimg.cn/large/0068yjmdgy1heohpxpsssj30j60edq4h.jpg,https://wx4.sinaimg.cn/large/0068yjmdgy1heohpzipvij30j60edwfw.jpg,https://wx2.sinaimg.cn/large/0068yjmdgy1heohq1e3xlj30j60edmyw.jpg",,,2023-06-06,微博网页版,0,0,0,我国首艘国产大邮轮出坞,,2023-06-06 14:36:06
