id,bid,正文,头条文章url,原始图片url,视频url,位置,日期,工具,点赞数,评论数,转发数,话题,@用户
4906499111128307	,N2J4r4Jwv,【出征在即！#神十六各系统准备就绪#】5月28日，神舟十六号载人飞船发射任务组织全区合练。目前，发射任务各系统已经完成了相关功能检查，并做好发射前的各项准备工作。一起期待#神十六发射#！（人民日报） ,,https://wx2.sinaimg.cn/large/0068yjmdgy1heegr1rx9dj30j60cs0vp.jpg,,,2023-05-28,微博网页版,2,0,0,"神十六各系统准备就绪,神十六发射",,2023-05-28 22:26:49
4906498826965109	,N2J3YtdWt,【欢快！#男孩舞蹈课上自由发挥超享受#】近日，浙江温州。舞蹈课上老师让自由发挥，一名男孩跳到满头大汗，十分投入，尽情享受着跳舞的快乐。网友：他的眼中全是热爱！（中国青年报）人民日报的微博视频 ,,,"https://f.video.weibocdn.com/o0/eGDeD9Pglx085N8FWEms01041200pOd10E010.mp4?label=mp4_720p&template=720x1280.24.0&ori=0&ps=1CwnkDw1GXwCQx&Expires=1687149678&ssig=3kBsl3USxB&KID=unistore,video",,2023-05-28,微博视频号,2,0,0,男孩舞蹈课上自由发挥超享受,,2023-05-28 22:25:41
4906498646608476	,N2J3GrJak,【转发纪念！#C919商业首航成功#】上海起飞，落地北京，#2张照片记录C919商业首航起降时刻#↓↓祝贺国产大飞机商业首航成功！（人民日报） ,,"https://wx4.sinaimg.cn/large/0068yjmdgy1heegozcppej30a00f0dg2.jpg,https://wx3.sinaimg.cn/large/0068yjmdgy1heegoz84s3j30a00f6weh.jpg",,,2023-05-28,微博网页版,0,0,0,"C919商业首航成功,2张照片记录C919商业首航起降时刻",,2023-05-28 22:24:58
4906495869195815	,N2IZcCAfB,【美！#璀璨星河与蓝眼泪梦幻同框#】近日，福建台山岛，摄影师拍到璀璨星河与海滩“蓝眼泪”奇观同框的梦幻画面。碎钻般的星星装点着夜空，海水中的礁石宛若佩戴着蓝宝石项链，水光与天光相映，浪漫风光令人沉醉。（人民日报）荔枝风景线的微博视频 ,,,"https://f.video.weibocdn.com/o0/MFPFQI1elx085MOftaY801041200eOaq0E010.mp4?label=mp4_720p&template=1280x720.25.0&ori=0&ps=1CwnkDw1GXwCQx&Expires=1687149678&ssig=Bmosc3ZkbP&KID=unistore,video",,2023-05-28,微博视频号,0,0,1,璀璨星河与蓝眼泪梦幻同框,,2023-05-28 22:13:56
4906442572434102	,N2HBfaddI,【转存小知识！#民航飞机窗户为啥没方形的#】飞机舷窗为什么是椭圆形？航空动力专家刘大响院士专门联络了C919总设计师吴光辉院士，#两位航空院士接力回答小朋友问题#：高空气压低，为使乘客更舒适，机舱内会增加压力，内外存在压力差。要让舷窗均匀受力，所以设计成了圆角↓央视新闻的微博视频 ,,,"https://f.video.weibocdn.com/o0/fmzO5tP3lx085N7FVxwQ01041200DcVe0E010.mp4?label=mp4_720p&template=720x720.24.0&ori=0&ps=1CwnkDw1GXwCQx&Expires=1687149678&ssig=kytxqqxR1I&KID=unistore,video",,2023-05-28,微博视频号,0,0,0,"民航飞机窗户为啥没方形的,两位航空院士接力回答小朋友问题",,2023-05-28 18:42:09
4906432564824667	,N2Hl6kf7d,【出征在即！#神十六各系统准备就绪#】5月28日，神舟十六号载人飞船发射任务组织全区合练。目前，发射任务各系统已经完成了相关功能检查，并做好发射前的各项准备工作。一起期待#神十六发射#！神舟十六号完成全区合练 各系统准备就绪（人民日报） ,,https://wx2.sinaimg.cn/large/0068yjmdgy1hee93ublyuj30j60csjsy.jpg,,,2023-05-28,OPPO Reno7 Pro 5G,0,0,0,"神十六各系统准备就绪,神十六发射",,2023-05-28 18:02:23
4906432405440790	,N2HkQmPoG,【别走错！5月28日起海口美兰国际机场值机柜台有变更】因改造工程需要，自5月28日起，乘坐中国南方航空公司航班从美兰机场2号航站楼出行的旅客，请前往E值机岛办理值机业务，售票业务仍在D值机岛不变。变更后柜台业务分配如下：E01特殊旅客（轮椅、无陪、宠物、老年旅客等）；E02-09经济舱（中转旅客、团队旅客等）；E10-11明珠经济舱、头等舱（金银卡、军人等）。（海南日报）别走错！5月28日起海口美兰国际机场值机柜台有变更,,"https://wx3.sinaimg.cn/large/0068yjmdgy1hee937v70kj30zk0qodq3.jpg,https://wx1.sinaimg.cn/large/0068yjmdgy1hee938lid0j30zk0qo7fi.jpg,https://wx3.sinaimg.cn/large/0068yjmdgy1hee9396nkej30zk0qon72.jpg",,,2023-05-28,OPPO Reno7 Pro 5G,0,0,0,,,2023-05-28 18:01:45
4906299625572973	,N2DSGnnMF,【海口天气】海口市气象台2023年5月28日8时发布未来3天天气预报：今天白天到夜间，多云，午后有雷阵雨，市区气温26-34℃，乡镇气温26-35℃，东南风转偏西风3-4级，近海海面5级，阵风6级；29日（星期一），多云，气温26-35℃；30日（星期二），多云，气温26-36℃。 ,,https://wx3.sinaimg.cn/large/0068yjmdgy1hedtu9kwf6j30px0b3ad1.jpg,,,2023-05-28,微博网页版,0,0,0,,,2023-05-28 09:14:08
4906141119679291	,N2zL1EC1B,【祝贺！#樊振东王楚钦世锦赛男双冠军#】当地时间5月27日，2023年世乒赛在南非德班结束男双决赛争夺，中国队樊振东/王楚钦以3:0击败韩国队张禹珍/林钟勋，首夺男双冠军。此前，王楚钦/孙颖莎夺得混双冠军，而男单、女单方面也已锁定金牌。网友：#数数国乒兜里已有四块金牌了#。（人民日报） ,,"https://wx2.sinaimg.cn/large/0068yjmdgy1hedbmo33wwj30j60butb7.jpg,https://wx3.sinaimg.cn/large/0068yjmdgy1hedbmpo6d8j30j60eyjs9.jpg,https://wx4.sinaimg.cn/large/0068yjmdgy1hedbmr9yqqj30j60c8n05.jpg,https://wx1.sinaimg.cn/large/0068yjmdgy1hedbmtpxp8j30j60nytff.jpg",,,2023-05-27,微博网页版,0,0,0,"樊振东王楚钦世锦赛男双冠军,数数国乒兜里已有四块金牌了",,2023-05-27 22:44:17
4906140808255031	,N2zKwyDvF,【#阿雅克库木湖碧波荡漾美若仙境#】#夏日里阿雅克库木湖的治愈系色彩#入夏以来，位于新疆南部昆仑山与阿尔金山山脉间的阿雅克库木湖碧波荡漾，在蓝天白云的映衬下，湛蓝的湖水宛如一块碧玉镶嵌其中，美若仙境。阿雅克库木湖是一座高原咸水湖，水域面积在过去30年间快速增加，2021年底已达1127.72平方公里，这意味着它已超过水域面积多年平均在1064平方公里的博斯腾湖，成为新疆水域面积最大的湖泊。（新华网）新华网的微博视频,,,"https://f.video.weibocdn.com/o0/kJUtyMYxlx085LzeKlHi01041200BwX40E010.mp4?label=mp4_720p&template=1280x720.25.0&ori=0&ps=1BThihd3VLAY5R&Expires=1687149679&ssig=Xz7KHWDkFn&KID=unistore,video",,2023-05-27,微博视频号,0,0,0,"阿雅克库木湖碧波荡漾美若仙境,夏日里阿雅克库木湖的治愈系色彩",,2023-05-27 22:43:03
4906137608263302	,N2zFmyFF4,【#大熊猫萌二掰竹子名场面#来了！#第一次见大熊猫咬牙切齿#】每只大熊猫都有自己的绝活儿！“萌二”掰竹子名场面来了！隔着屏幕都想替它用力  @红星视频 （中国新闻网）红星视频的微博视频 ,,,"https://f.video.weibocdn.com/o0/mUdVIWwMlx085LW6NFVK010412007rIf0E010.mp4?label=mp4_720p&template=720x1280.24.0&ori=0&ps=1CwnkDw1GXwCQx&Expires=1687149679&ssig=JpB%2F91WdUQ&KID=unistore,video",,2023-05-27,微博视频号,1,0,0,"大熊猫萌二掰竹子名场面,第一次见大熊猫咬牙切齿",红星视频,2023-05-27 22:30:20
4906128221670076	,N2zqe70sI,【明天#全国爱发日#，收好这份超实用“防秃攻略”】①正常发际线通常为眉上4指宽；②熬夜、过量饮酒、频繁烫染、压力大为年轻人脱发四大原因；③#盲目用生姜黑芝麻丸或加重脱发#…了解“头顶大事”↓守住发际线，拒绝“秃”然慌！ （人民日报） ,,"https://wx3.sinaimg.cn/large/0068yjmdgy1heda531h0rj30go0l3wgq.jpg,https://wx3.sinaimg.cn/large/0068yjmdgy1heda54fiqfj30go0gpdhi.jpg,https://wx3.sinaimg.cn/large/0068yjmdgy1heda55twjzj30go0meq5t.jpg,https://wx1.sinaimg.cn/large/0068yjmdgy1heda576hlcj30go0nnwh0.jpg,https://wx1.sinaimg.cn/large/0068yjmdgy1heda58vg4wj30go0n3q6d.jpg,https://wx1.sinaimg.cn/large/0068yjmdgy1heda5avll1j30go0s9q64.jpg,https://wx1.sinaimg.cn/large/0068yjmdgy1heda5cygc6j30go0nnwh9.jpg,https://wx3.sinaimg.cn/large/0068yjmdgy1heda5esaw3j30go0i9q53.jpg,https://wx3.sinaimg.cn/large/0068yjmdgy1heda5h9o0tj30go0s9whb.jpg",,,2023-05-27,微博网页版,0,0,1,"全国爱发日,盲目用生姜黑芝麻丸或加重脱发",,2023-05-27 21:53:02
4906127806697757	,N2zpys6ol,【为国产大飞机转发！#6分钟看C919的16年#】国产大飞机C919即将迎来商业首航，一段视频回顾它16年成长全记录。#这是一次载入史册的飞行#，视频有些长，但真的值得一看！戳↓↓（新华社）新华社的微博视频 ,,,"https://f.video.weibocdn.com/o0/t71CCvtqlx085LYMpaWQ01041203sfcX0E020.mp4?label=mp4_720p&template=1280x720.25.0&ori=0&ps=1CwnkDw1GXwCQx&Expires=1687149679&ssig=Z2AsjHBJTV&KID=unistore,video",,2023-05-27,微博视频号,0,0,1,"6分钟看C919的16年,这是一次载入史册的飞行",,2023-05-27 21:51:23
4906127332215312	,N2zoN9iiQ,【#哪些人是二阳的重点人群#？做好防护】#二阳主要集中在三类人群# 专家提醒，不同的人群感染的机会和临床的表现、病情的进展可能会有不同的差异，对于既往免疫低下、高龄、有基础疾病的患者，再次感染的风险相对高于普通人群。另外，既往疫苗注射或者是相对于第一次感染距离现在时间比较长、机体免疫保护能力在下降的人群，也是二次感染机会更大的一个相对风险人群。第三类人群就是我们需要重点关注的人群，长期暴露于高风险环境的人群，比如医护人员、新冠患者或者疑似患者的照顾人员，都可能由于暴露机会的增多，增加二次感染机会。#二阳是因为免疫力到期了吗#（央视网）央视网的微博视频,,,"https://locallimit.us.sinaimg.cn/o0/JveQWR4Qlx085LLWxrR601041200baJZ0E010.mp4?label=mp4_720p&template=864x486.25.0&ori=0&ps=1BThihd3VLAY5R&Expires=1687149680&ssig=O7sE3vOeWo&KID=unistore,video",,2023-05-27,微博视频号,0,0,0,"哪些人是二阳的重点人群,二阳主要集中在三类人群,二阳是因为免疫力到期了吗",,2023-05-27 21:49:30
4906127038352654	,N2zojz2Ue,【别信！#人社部辟谣四种颜色社保卡科普帖#】社保卡是大家享有就业、社保等权益的凭证，是政府民生服务的重要载体。近日，网上流传“社保卡有四种颜色”的科普帖，人社部官方辟谣：都是误读！社保卡有哪些隐藏功能？出门忘带社保卡，#电子社保卡怎样申领#？详戳↓↓  （人民日报）社保卡有四种颜色？看这篇，拒绝误传！,,,,,2023-05-27,微博网页版,1,0,0,"人社部辟谣四种颜色社保卡科普帖,电子社保卡怎样申领",,2023-05-27 21:48:20
4906124761107514	,N2zkE4E78,【#2个动作帮你消灭小肚腩#】夏天来了，想跟小肚腩说拜拜？试试这两个动作↓↓坚持练习，帮你练腹肌、增强核心力量。别光马不练~ （央视新闻）@央视一套 央视一套的微博视频 ,,,"https://f.video.weibocdn.com/o0/UMzK2w7ylx085H1YJOeQ010412010sgT0E010.mp4?label=mp4_720p&template=1280x720.25.0&ori=0&ps=1CwnkDw1GXwCQx&Expires=1687149679&ssig=itVJBVQHHH&KID=unistore,video",,2023-05-27,微博视频号,1,0,0,2个动作帮你消灭小肚腩,央视一套,2023-05-27 21:39:17
4906072865771284	,N2xYWodne,#6.66万余个自媒体账号永久关闭#【#92万余个违规自媒体账号被处置#】记者27日从中央网信办获悉，按照“清朗·从严整治‘自媒体’乱象”专项行动要求，3月10日以来，各级网信部门严肃查处各类违规“自媒体”账号；微博、腾讯、抖音、快手等重点平台积极履行信息内容管理主体责任，依法依约处置“自媒体”造谣传谣、假冒仿冒、违规营利等突出问题。#永久关闭6万多个自媒体账号# （新华社）92万余个违规“自媒体”账号被处置,,,,,2023-05-27,微博网页版,0,0,0,"6.66万余个自媒体账号永久关闭,92万余个违规自媒体账号被处置,永久关闭6万多个自媒体账号",,2023-05-27 18:13:04
4906072387880761	,N2xYax493,【转需！#6个建议助你睡个好觉#】你有没有遇到过越努力入睡，越容易失眠的情况？#提前酝酿睡意或更易导致失眠#！睡眠是人类非常重要的一项生理活动，人的一生约有三分之一的时间都在睡眠中度过。有哪些常见的睡眠问题？要避免陷入哪些睡眠误区？如何治疗失眠？一文读懂↓↓帮你今晚睡个好觉！（人民日报）如何提高睡眠质量？知识点都在这里，快来学！,,,,,2023-05-27,微博网页版,0,0,0,"6个建议助你睡个好觉,提前酝酿睡意或更易导致失眠",,2023-05-27 18:11:10
4906071565012810	,N2xWQl23M,【白白胖胖！#全球唯一限定色大熊猫#】27日，四川卧龙，#全球唯一白色大熊猫正脸照首度公布#。和正常毛色的大熊猫相比，白色大熊猫去掉了黑眼圈、洗白了黑耳朵、卸掉了经典黑白脸谱妆容。网友：看来它从不熬夜！@人民网四川频道 四川卧龙首度公布全球唯一的白色大熊猫正脸照 （人民网）人民网的微博视频,,,"https://f.video.weibocdn.com/o0/I5Mcauonlx085LHoHa3S01041200Qxdh0E010.mp4?label=mp4_720p&template=1280x720.25.0&ori=0&ps=1BThihd3VLAY5R&Expires=1687149681&ssig=KMLK3XyEZO&KID=unistore,video",,2023-05-27,微博视频号,0,0,0,"全球唯一限定色大熊猫,全球唯一白色大熊猫正脸照首度公布",人民网四川频道,2023-05-27 18:07:54
4906070985676753	,N2xVUnOMx,【@ 高考生 #今年新增21种普通本科新专业# 在这些高校设立】#关注2023年高考招生# 距离高考还有一个多星期，根据最新公布的普通本科专业备案和审批结果，今年高考招生共新增了21种普通本科专业，有的与社会生活需要紧密相关，比如南京特殊教育师范学院新增的孤独症儿童教育、无障碍管理，中华女子学院新增的家庭教育；有的与城乡建设紧密相关，比如海南大学新增的乡村治理，北京林业大学新增的国家公园建设与管理；还有的与前沿技术发展紧密相关，比如，清华大学新增的地球系统科学，华南理工大学新增的生物材料，东南大学新增的未来机器人、电动载运工程。（央视网）央视网的微博视频,,,"https://locallimit.us.sinaimg.cn/o0/PWx4ANtelx085LouA8jK01041200bqPo0E010.mp4?label=mp4_ld&template=640x360.25.0&ori=0&ps=1BThihd3VLAY5R&Expires=1687149681&ssig=O3h5Arch8R&KID=unistore,video",,2023-05-27,微博视频号,0,0,0,"今年新增21种普通本科新专业,关注2023年高考招生",,2023-05-27 18:05:36
4906037544484968	,N2x3YiOKc,【海口市国际中医中心项目加快幕墙施工】2023年5月24日，在海口市国际中医中心项目现场，施工人员在加快进行幕墙施工。据了解，海口市国际中医中心项目总建筑面积100057.44平方米，建设内容包括新建门诊医技住院综合楼、科研应急保障综合楼及附属建筑等。项目建成后，可新增床位500张，对提供优质中医医疗服务，提升区域百姓的生活水平和医疗质量，有着重要意义。（海南日报）,,"https://wx1.sinaimg.cn/large/0068yjmdgy1heczqjbuknj30xc0m7dqo.jpg,https://wx1.sinaimg.cn/large/0068yjmdgy1heczqjyz90j30xc0m7gxq.jpg,https://wx3.sinaimg.cn/large/0068yjmdgy1heczqki6luj30xc0m8k2d.jpg",,,2023-05-27,OPPO Reno7 Pro 5G,0,0,0,,,2023-05-27 15:52:42
4906037196884438	,N2x3psSXk,【周知！#关于二阳的多个认识误区#】#二阳是因为免疫力到期了吗#？感染新冠不发烧意味着免疫力更强？一个人最多感染8次新冠？出现嗓子痛就是“二阳”吗？……关于“二阳”的多个认知误区，戳文章了解↓↓  （人民日报）感染新冠不发烧，意味着免疫力更强？这些误区一定要知道！ ,,,,,2023-05-27,OPPO Reno7 Pro 5G,0,0,0,"关于二阳的多个认识误区,二阳是因为免疫力到期了吗",,2023-05-27 15:51:20
4905938781474073	,N2uuG6btn,【#在珠峰8450米他们放弃登顶救人一命#】#珠峰上的生命接力# 近日，湖南省登山队的范江涛、谢如祥攀登珠峰时，在距峰顶不到400米发现一名遇险登山者。遇险者脸上覆盖薄冰，手被冻伤，生命体征微弱。范谢二人尚有体力冲顶，面对多年登顶梦想，他们还是选择救人。他们和当地向导一起，架人、背人，成功将遇险者救回营地。“不后悔，救人比登顶珠峰更重要！”网友：艰难的抉择，心有大爱，赞！（央视新闻）放弃登顶！海拔8450米，他们救回一条人命 央视新闻的微博视频,,,"https://f.video.weibocdn.com/o0/KptSBNYvlx085L9ukXyg01041200i20m0E010.mp4?label=mp4_720p&template=864x486.25.0&ori=0&ps=1BThihd3VLAY5R&Expires=1687149682&ssig=Qwwn0NAI2Y&KID=unistore,video",,2023-05-27,微博视频号,0,0,0,"在珠峰8450米他们放弃登顶救人一命,珠峰上的生命接力",,2023-05-27 09:20:16
4905935245938385	,N2uoYoUQp,【海口美兰国际机场今年来旅客吞吐量突破1000万人次，已接近2019年同期水平】今年来，海口美兰国际机场旅客吞吐量呈现“飘红”趋势，截至5月26日，美兰机场累计运输航班已达7.04万架次、运送旅客突破1000万人次，已接近2019年同期水平，进一步为海南自贸港航空市场的复苏和高质量发展注入新动能，再添新活力。（海口日报）海口美兰国际机场今年来旅客吞吐量突破1000万人次，已接近2019年同期水平,,https://wx2.sinaimg.cn/large/0068yjmdgy1hecnzhhuh6j30j60csq4n.jpg,,,2023-05-27,微博网页版,0,0,0,,,2023-05-27 09:06:13
4905927600505859	,N2ucE27B1,"【#海口发布雷电黄色预警信号#】海口市气象台2023年05月27日08时29分发布雷电黄色预警信号：受对流云团影响，我市市区东部、大致坡镇、三江镇、云龙镇、龙塘镇、红旗镇、灵山镇、旧州镇、演丰镇今日09时至18时可能发生雷电活动，可能会出现雷电灾害事故，建议有关单位和人员做好防范工作。防御指南：1.政府及相关部门按照职责做好防雷防风工作；2.密切关注天气，尽量避免户外活动；3.把门窗、围板、棚架、临时搭建物等易被风吹动的搭建物固紧, 人员应当尽快离开临时搭建物，妥善安置易受雷雨大风影响的室外物品。",,https://wx1.sinaimg.cn/large/0068yjmdgy1hecn3powx3j30m20v7gnm.jpg,,,2023-05-27,微博网页版,0,0,0,海口发布雷电黄色预警信号,,2023-05-27 08:35:50
4905925255368678	,N2u8RmwDA,【专家：#憋尿属于不是不报时候未到# 后果很严重！】#尽量少憋尿# 很多人都有过憋尿的经历，早上赖床不想起床憋，工作太忙没空上厕所憋，憋得不行了才去上厕所，终于浑身舒坦了。专家提示，总是憋尿，膀胱功能变弱，会导致想尿的时候尿不出来，不想尿的时候却误以为要尿。长期憋尿还有9种危害，@ 所有人 都看下！ 快改掉这个坏习惯吧~（央视网）央视网的微博视频,,,"https://locallimit.us.sinaimg.cn/o0/VxMMEESAlx085GRNt6t201041200f5ML0E010.mp4?label=mp4_720p&template=864x486.25.0&ori=0&ps=1BThihd3VLAY5R&Expires=1687149682&ssig=W91HqyBev8&KID=unistore,video",,2023-05-27,微博视频号,0,0,0,"憋尿属于不是不报时候未到,尽量少憋尿",,2023-05-27 08:26:31
4905924885479811	,N2u8gmZy3,【周知！#如何防范AI换脸诈骗#】近日，福州一科技公司老板遭遇AI换脸诈骗，10分钟被骗取430万元。AI换脸以假乱真的效果有多强？我们应该保护好哪些个人信息？有没有#识别AI换脸的技巧#？戳↓转发给亲朋好友，一起防范AI诈骗！（人民日报）人民日报的微博视频 ,,,"https://f.video.weibocdn.com/o0/0cTXhc7Blx085L6CJwSk01041200w2GT0E010.mp4?label=mp4_720p&template=720x1280.24.0&ori=0&ps=1CwnkDw1GXwCQx&Expires=1687149681&ssig=DsML09o3%2BV&KID=unistore,video",,2023-05-27,微博视频号,0,0,0,"如何防范AI换脸诈骗,识别AI换脸的技巧",,2023-05-27 08:25:02
4905923242101144	,N2u5C8OBq,【海口天气】海口市气象台2023年5月27日8时发布未来3天天气预报：今天白天到夜间，多云，局地有雷阵雨，市区气温26-34℃，乡镇气温26-35℃，东南风3-4级，近海海面5级，雷雨时阵风7-9级；28日（星期日），多云，午后有雷阵雨，气温26-34℃；29日（星期一），多云，气温26-35℃。 ,,https://wx4.sinaimg.cn/large/0068yjmdgy1hecmm2bvsyj30p00anwep.jpg,,,2023-05-27,微博网页版,1,0,0,,,2023-05-27 08:18:31
4905733893655321	,N2padfkUN,【#3个动作缓解眼疲劳#】电脑、电视、手机看久了，眼睛难免觉得酸涩、疲劳，试试这套护眼手指操：双指前推、手指画圆、手指侧移。一起放松眼部，锻炼眼睛灵活性吧！（人民日报）CCTV生活圈的微博视频 ,,,"https://f.video.weibocdn.com/o0/tDo8U2u6lx07XWpO1p3201041200LNtZ0E010.mp4?label=mp4_720p&template=1280x720.25.0&ori=0&ps=1CwnkDw1GXwCQx&Expires=1687149681&ssig=99xC9xcspf&KID=unistore,video",,2023-05-26,微博视频号,0,0,0,3个动作缓解眼疲劳,,2023-05-26 19:46:07
4905725945448203	,N2oXomRkf,#看夏收画卷在祖国各地徐徐展开#【#初夏丰收壁纸上新了#】初夏时节，多种农作物陆续成熟，一幅幅丰收画卷在祖国各地徐徐展开。 （新华社） ,,"https://wx3.sinaimg.cn/large/0068yjmdgy1hebzxo3yuvj30j60azn0h.jpg,https://wx4.sinaimg.cn/large/0068yjmdgy1hebzxpjnisj30j60as0w4.jpg,https://wx3.sinaimg.cn/large/0068yjmdgy1hebzxr2ru4j30j60csn1r.jpg,https://wx3.sinaimg.cn/large/0068yjmdgy1hebzxtcyclj30j60cs41i.jpg,https://wx1.sinaimg.cn/large/0068yjmdgy1hebzxtx0ycj30j60adwhf.jpg,https://wx4.sinaimg.cn/large/0068yjmdgy1hebzxvhfllj30j60as0xu.jpg,https://wx4.sinaimg.cn/large/0068yjmdgy1hebzxx3th0j30j60asdki.jpg,https://wx3.sinaimg.cn/large/0068yjmdgy1hebzxz9tyrj30j60cs0zk.jpg,https://wx2.sinaimg.cn/large/0068yjmdgy1hebzy0yul3j30j60asq58.jpg",,,2023-05-26,微博网页版,0,0,0,"看夏收画卷在祖国各地徐徐展开,初夏丰收壁纸上新了",,2023-05-26 19:14:32
4905722443992087	,N2oRKgKwv,【#女子丝滑AI变脸反诈宣传#】近日，网友“超级头脑AI魔法师”发布了一条公益科普视频：“你以为网聊的网友长这样，结果长这样……”↓↓ 网友：#这波丝滑变脸反诈宣传真的很深刻#。（人民网）人民网的微博视频 ,,,"https://f.video.weibocdn.com/o0/g1AYF7VRlx085JTVMWkw01041200mmEb0E010.mp4?label=mp4_720p&template=720x1280.24.0&ori=0&ps=1CwnkDw1GXwCQx&Expires=1687149683&ssig=s8t4R1spMV&KID=unistore,video",,2023-05-26,微博视频号,2,1,0,"女子丝滑AI变脸反诈宣传,这波丝滑变脸反诈宣传真的很深刻",,2023-05-26 19:00:37
4905700562043050	,N2ois8zuq,【实用收藏！一图搞懂备药指南！】多地现新冠“二阳”？第二轮疫情要来？专家提示大家，可重视但无需恐慌！中国医药教育协会发布《新冠病毒常态化防控居家用药指南图解系列》。本系列由家庭药箱指南(健康公众版)、新冠轻症患者居家用药指南、慢病人群新冠应对指南共3个部分组成。其中，慢病人群新冠应对指南针对常见慢病下设糖尿病篇、慢性肾脏病篇、心脑血管疾病篇、肿瘤篇共4个篇章。点击图片查看,,"https://wx2.sinaimg.cn/large/0068yjmdgy1hebx19dtqcj30ku9tt7wi.jpg,https://wx3.sinaimg.cn/large/0068yjmdgy1hebx1b16pcj30i2cmwhdu.jpg,https://wx3.sinaimg.cn/large/0068yjmdgy1hebx1by2zzj30ku2gttof.jpg,https://wx3.sinaimg.cn/large/0068yjmdgy1hebx1cntg6j30ku6dbe81.jpg,https://wx3.sinaimg.cn/large/0068yjmdgy1hebx1dzuu5j30ku65pb29.jpg,https://wx1.sinaimg.cn/large/0068yjmdgy1hebx1ep5zuj30ku3uwtvt.jpg",,,2023-05-26,OPPO Reno7 Pro 5G,9,0,11,,,2023-05-26 17:33:39
4905700020978547	,N2ohA46z1,【勇敢汪汪！#军犬1200米高空跳伞一脸淡定#】近日，军犬“小罗”全副武装，跟随训导员从1200米高空一跃而下，圆满完成跳伞任务。飞翔、转弯、落地，“小罗”实力诠释“酷飒本色”↓↓网友：降落伞打开的一瞬间，真的太帅了！（中国军事网）中国军视网的微博视频 ,,,"https://f.video.weibocdn.com/o0/mWMA9In7lx085JH1vtpm01041200R5NU0E010.mp4?label=mp4_720p&template=720x1280.24.0&ori=0&ps=1CwnkDw1GXwCQx&Expires=1687149683&ssig=e%2FmQ880oQd&KID=unistore,video",,2023-05-26,微博视频号,1,0,0,军犬1200米高空跳伞一脸淡定,,2023-05-26 17:31:31
4905699732096924	,N2oh78Nvm,【27所中国军校，等你报考】高考倒计时，27所军队院校向有志国防的莘莘学子发出邀请。携笔从戎，强军报国，#27所军校请高考生入列#。军校，等你！收藏。  （人民日报）27所中国军校，等你报考！ ,,,,,2023-05-26,OPPO Reno7 Pro 5G,1,0,0,27所军校请高考生入列,,2023-05-26 17:30:22
